url,title,is_clickbait
https://cincodias.elpais.com/opinion/2025-06-09/pacto-de-estado-para-crecer-mejor-y-distribuir-mas.html,Pacto de Estado para crecer mejor y distribuir más,0
https://cincodias.elpais.com/economia/2025-06-09/la-apuesta-que-europa-no-puede-permitirse-perder-eurobonos.html,La apuesta que Europa no puede permitirse perder: los eurobonos,0
https://cincodias.elpais.com/opinion/2025-06-07/lecciones-ante-el-mar-de-fondo-del-mercado-de-deuda.html,Lecciones ante el mar de fondo del mercado de deuda,0
https://cincodias.elpais.com/mercados-financieros/2025-06-09/trump-y-bessent-dan-un-giro-de-180-grados-lo-que-es-malo-para-la-economia-suele-ser-bueno-para-la-bolsa.html,Trump y Bessent dan un giro de 180 grados: “Lo que es malo para la economía suele ser bueno para la Bolsa”,0
https://elpais.com/economia/2025-06-09/el-supremo-decidira-en-julio-definitivamente-sobre-la-indemnizacion-por-despido.html,El Supremo decidirá en julio definitivamente sobre la indemnización por despido,0
https://elpais.com/economia/2025-06-09/oscar-lopez-abre-la-puerta-a-mejoras-en-el-modelo-de-muface-si-las-consensua-el-congreso.html,Óscar López abre la puerta a mejoras en el modelo de Muface si las consensúa el Congreso,0
https://cincodias.elpais.com/companias/2025-06-07/hacienda-pospone-la-norma-para-elevar-el-alcohol-libre-de-impuestos-en-los-cruceros-turisticos.html,Hacienda pospone la norma para elevar el alcohol libre de impuestos en los cruceros turísticos,0
https://elpais.com/economia/2025-06-06/la-creacion-de-empleo-supero-en-mayo-las-expectativas-en-estados-unidos.html,La creación de empleo en Estados Unidos superó las expectativas en mayo,0
https://elpais.com/extra/medio-ambiente/2025-06-05/luis-vayas-valdivieso-los-plasticos-no-solo-contaminan-el-planeta-son-capaces-de-cambiar-nuestro-adn.html,"Luis Vayas-Valdivieso: “Los plásticos no solo contaminan el planeta, son capaces de cambiar nuestro ADN”",0
https://elpais.com/extra/medio-ambiente/2025-06-05/contaminar-menos-tiene-alguna-ventaja-fiscal.html,Contaminar menos tiene (alguna) ventaja fiscal,0
https://cincodias.elpais.com/extras/asturias/2025-05-31/la-marca-asturias-paraiso-natural-cumple-40-anos.html,"La marca Asturias, paraíso natural cumple 40 años",0
https://cincodias.elpais.com/extras/asturias/2025-05-30/la-alta-velocidad-y-las-nuevas-conexiones-aereas-disparan-el-numero-de-viajeros-en-asturias.html,La alta velocidad y las nuevas conexiones aéreas disparan el número de viajeros en Asturias,0
https://cincodias.elpais.com/mercados-financieros/2025-06-09/invertir-en-bolsa-espanola-de-ser-una-idea-caduca-a-brillar-en-2025.html,"Invertir en Bolsa española, de ser una idea caduca a brillar en 2025",0
https://cincodias.elpais.com/mercados-financieros/2025-06-06/nvidia-da-por-superada-en-bolsa-la-crisis-de-deepseek.html,Nvidia da por superada en Bolsa la crisis de DeepSeek,0
https://cincodias.elpais.com/mercados-financieros/2025-06-06/hello-kitty-bate-a-toyota-como-la-empresa-con-mayor-negociacion-de-acciones-en-la-bolsa-de-tokio.html,Hello Kitty bate a Toyota como la empresa con mayor negociación de acciones en la Bolsa de Tokio,0
https://cincodias.elpais.com/mercados-financieros/2025-06-06/las-claves-del-optimismo-de-lagarde-como-impactaria-una-guerra-comercial-y-por-que-pueden-seguir-bajando-los-tipos.html,Las claves del optimismo de Lagarde: cómo impactaría una guerra comercial y por qué pueden seguir bajando los tipos,0
https://cincodias.elpais.com/extras/2025-06-04/juan-jose-llorente-adyen-la-ia-tiene-un-impacto-medible-en-la-conversion-de-ventas-la-fidelizacion-y-la-reduccion-del-fraude.html,"Juan José Llorente (Adyen): “La IA tiene un impacto medible en la conversión de ventas, la fidelización y la reducción del fraude”",0
https://cincodias.elpais.com/companias/2025-06-09/edreams-lanza-un-bono-de-375-millones-de-euros-para-cancelar-otra-deuda-y-alargar-vencimientos.html,Edreams lanza un bono de 375 millones de euros para cancelar otra deuda y alargar vencimientos,0
https://cincodias.elpais.com/companias/2025-06-09/las-grandes-inmobiliarias-se-arriesgan-con-negocios-poco-tradicionales-para-crecer.html,Las grandes inmobiliarias se arriesgan con negocios poco tradicionales para crecer,0
https://cincodias.elpais.com/companias/2025-06-09/el-fondo-de-inversion-de-la-universidad-de-berkeley-compra-el-75-del-capital-de-la-startup-malaguena-aliqindoi.html,"El fondo de inversión de la Universidad de Berkeley compra el 7,5% del capital de la startup malagueña Aliqindoi",0
https://cincodias.elpais.com/companias/2025-06-09/la-startup-nova-cierra-una-ronda-de-32-millones-para-la-expansion-internacional-de-su-linkedin-de-talento-profesional.html,"La startup Nova cierra una ronda de 3,2 millones para la expansión internacional de su “LinkedIn” de talento profesional",0
https://elpais.com/economia/2025-06-09/europa-necesita-invertir-mas-en-casa-una-nueva-etiqueta-de-ahorro-ofrece-un-comienzo-en-ese-viaje.html,Europa necesita invertir más en casa: una nueva etiqueta de ahorro ofrece un comienzo en ese viaje,0
https://elpais.com/economia/negocios/2025-06-09/mohit-kumar-jefferies-china-puede-resistir-mucho-mas-que-trump-ee-uu-tendra-que-recular.html,Mohit Kumar (Jefferies): “China puede resistir mucho más que Trump. EE UU tendrá que recular”,0
https://elpais.com/economia/negocios/2025-06-09/china-y-ee-uu-eligen-campo-de-batalla-el-congo.html,China y EE UU eligen campo de batalla: el Congo,0
https://elpais.com/economia/negocios/entrevistas-afterwork/2025-06-09/rodrigo-gribble-novo-nordisk-me-estoy-enganchando-al-padel-pero-soy-malisimo.html,"Rodrigo Gribble (Novo Nordisk): “Me estoy enganchando al pádel, pero soy malísimo”",0
https://cincodias.elpais.com/fondos-y-planes/2025-06-09/felipe-leria-ubp-seguimos-muy-positivos-en-deuda-corporativa-de-alto-rendimiento.html,Felipe Lería (UBP): “Seguimos muy positivos en deuda corporativa de alto rendimiento”,0
https://cincodias.elpais.com/fondos-y-planes/2025-06-03/el-mayor-banco-publico-de-suiza-desembarca-en-espana-con-su-gestora-de-fondos.html,El mayor banco público de Suiza desembarca en España con su gestora de fondos,0
https://cincodias.elpais.com/fondos-y-planes/2025-06-01/la-cartera-clasica-de-bolsa-y-bonos-se-reivindica-para-rentar-mas-del-5-tae-a-largo-plazo.html,La cartera clásica de Bolsa y bonos se reivindica para rentar más del 5% TAE a largo plazo,0
https://cincodias.elpais.com/fondos-y-planes/2025-05-28/bankinter-mantiene-la-apuesta-por-las-carteras-de-bonos-a-vencimiento-con-dos-fondos.html,Bankinter mantiene la apuesta por las carteras de bonos a vencimiento con dos fondos,0
https://cincodias.elpais.com/fortunas/2025-06-01/son-los-videojuegos-rentables-en-espana-lejos-del-fifa-o-gta-v-radiografia-de-un-sector-que-factura-2400-millones-de-euros.html,¿Son los videojuegos rentables en España lejos del ‘Fifa’ o ‘GTA V’? Radiografía de un sector que factura 2.400 millones de euros,0
https://cincodias.elpais.com/fortunas/2025-05-25/asumir-que-las-divas-tambien-pierden-o-como-digerir-un-fracaso.html,Asumir que las divas también pierden o cómo digerir un fracaso,0
https://cincodias.elpais.com/fortunas/2025-05-22/mandarin-oriental-busca-ricos-en-espana-para-sus-pisos-de-lujo-en-miami.html,Mandarin Oriental busca ricos en España para sus pisos de lujo en Miami,0
https://cincodias.elpais.com/legal/2025-06-09/la-periodista-de-aranzadi-la-ley-patricia-esteban-premio-melon-2025-del-colegio-de-gestores-administrativos-de-madrid.html,"La periodista de Aranzadi LA LEY Patricia Esteban, Premio Melón 2025 del Colegio de Gestores Administrativos de Madrid",0
https://cincodias.elpais.com/legal/2025-06-09/sunny-mann-nuevo-presidente-global-de-baker-mckenzie.html,"Sunny Mann, nuevo presidente global de Baker McKenzie",0
https://cincodias.elpais.com/legal/2025-06-09/los-procuradores-se-postulan-como-mediadores-en-el-pulso-entre-jueces-y-fiscales-y-el-congreso-a-cuenta-de-la-ley-de-acceso-a-la-profesion.html,Los procuradores se postulan como mediadores en el pulso entre jueces y fiscales y el Congreso a cuenta de la ley de acceso a la profesión,0
https://cincodias.elpais.com/opinion/2025-06-06/hay-que-mantener-las-entidades-hipotecarias-fannie-y-freddie-mac-bajo-estricto-control-financiero.html,Hay que mantener las entidades hipotecarias Fannie y Freddie Mac bajo estricto control financiero,0
https://cincodias.elpais.com/opinion/2025-06-06/el-auge-de-los-bolsos-coach-es-una-llamada-de-atencion-para-el-lujo-europeo.html,El auge de los bolsos Coach es una llamada de atención para el lujo europeo,0
https://cincodias.elpais.com/opinion/2025-06-05/los-robotaxis-pasan-de-ser-una-exageracion-a-una-posibilidad-quiza-rentable.html,Los robotaxis pasan de ser una exageración a una posibilidad quizá rentable,0
https://cincodias.elpais.com/smartlife/tablets/2025-06-10/ipados-26-lanzamiento-novedades-ipad-compatibles-wwdc-25.html,"iPadOS 26 ya es oficial, con un nuevo diseño Liquid Glass y mucha IA",0
https://cincodias.elpais.com/smartlife/smartphones/2025-06-09/ios-26-lista-iphone-compatible.html,iOS 26: lista de los iPhone que son compatibles con esta actualización,0
https://cincodias.elpais.com/smartlife/gadgets/2025-06-10/watchos-26-lanzamiento-caracteristicas.html,"WWDC 2025: watchOS 26 ya es oficial, con más personalización que nunca y otras mejoras",0
https://motor.elpais.com/actualidad/cuanto-cuesta-el-coche-mas-vendido-de-ebro-tiene-etiqueta-cero-y-un-consumo-muy-bajo/,¿Cuánto cuesta el coche más vendido de Ebro? Tiene etiqueta Cero y un consumo muy bajo,0
https://as.com/tenis/roland_garros/el-mundo-a-los-pies-de-alcaraz-nadie-olvidara-este-partido-n/,El mundo a los pies de Alcaraz: “¡Nadie olvidará este partido!”,0
https://retinatendencias.com/analisis/puede-groenlandia-apagar-los-incendios-de-california/,¿Puede Groenlandia apagar los incendios de California?,0
https://cincodias.elpais.com/mercados-financieros/2025-06-08/sebastian-raedler-bank-of-america-la-bolsa-europea-esta-descontando-un-escenario-economico-erroneo.html#?rel=lom,Sebastian Raedler (Bank of America): “La Bolsa europea está descontando un escenario económico erróneo”,0
https://elpais.com/tecnologia/2025-06-09/el-uso-excesivo-de-pantallas-lleva-a-los-ninos-a-necesitarlas-aun-mas.html,El uso excesivo de pantallas lleva a los niños a necesitarlas aún más,0
https://elpais.com/tecnologia/2025-06-07/grupos-falsos-y-canciones-artificiales-al-asalto-de-youtube-y-spotify.html,"Grupos falsos y canciones artificiales, al asalto de YouTube y Spotify",0
https://elpais.com/espana/2025-06-09/ribera-declara-en-el-senado-que-solo-se-reunio-una-sola-vez-con-aldama-y-niega-que-begona-gomez-estuviera-presente.html,Ribera declara en el Senado que solo se reunió “una sola vez” con Aldama y niega que Begoña Gómez estuviera presente,0
https://elpais.com/espana/2025-06-08/milei-anima-en-madrid-a-zurrar-al-bandido-local.html,Milei anima en Madrid a “zurrar al bandido local”,0
https://elpais.com/espana/madrid/2025-06-09/el-conductor-que-mato-a-dos-personas-en-el-paseo-de-extremadura-acepta-14-anos-de-prision-pido-perdon-a-las-familias.html,El conductor que mató a dos personas en el paseo de Extremadura acepta 14 años de prisión: “Pido perdón a las familias”,0
https://elpais.com/television/2025-06-09/elemental-querido-espectador-esta-es-la-guia-ideal-para-el-amante-del-policial-televisivo.html,"Elemental, querido espectador, esta es la guía ideal para el amante del policial televisivo",0
https://elpais.com/television/2025-06-09/bodegon-con-fantasmas.html,‘Bodegón con fantasmas’,0
https://elpais.com/television/2025-06-08/jack-rooke-creador-de-big-boys-los-hombres-son-mas-empaticos-de-lo-que-creemos-y-mas-de-como-la-cultura-y-la-ficcion-los-representan.html,"Jack Rooke, creador de ‘Big Boys’: “Los hombres son más empáticos de lo que creemos, y más de cómo la cultura y la ficción los representan”",0
https://elpais.com/gente/2025-06-06/jason-biggs-protagonista-de-american-pie-revela-su-batalla-contra-las-drogas-y-el-alcohol-me-meti-en-el-contenedor-de-basura-y-saque-la-bolsa-de-cocaina.html,"Jason Biggs, protagonista de ‘American Pie’, revela su batalla contra las drogas y el alcohol: “Me metí en el contenedor de basura y saqué la bolsa de cocaína”",0
https://elpais.com/gente/2025-06-07/sofia-carson-la-actriz-que-se-ha-convertido-en-el-ultimo-valor-seguro-de-netflix.html,"Sofia Carson, la actriz que se ha convertido en el último valor seguro de Netflix",0
https://elpais.com/smoda/placeres/2025-06-07/violeta-hodar-me-preocupaba-que-pensaran-que-me-habian-metido-en-ot-por-guapa.html,Violeta Hódar: “Me preocupaba que pensaran que me habían metido en ‘OT’ por guapa”,0
