url,title,is_clickbait
https://www.eldiario.es/politica/supremo-confirma-siete-anos-carcel-hombre-esclavizo-sexualmente-trabajadora-hogar_1_12320562.html,El Supremo confirma siete años de cárcel a un hombre que esclavizó sexualmente a una trabajadora del hogar,0
https://www.eldiario.es/economia/audiencia-nacional-ordena-busca-captura-expresidente-cepsa-qubaisi-blanqueo-venta-torre-foster_1_12369548.html,La Audiencia Nacional ordena la detención del expresidente de Cepsa Al Qubaisi por blanqueo en la venta de la Torre Foster,0
https://www.eldiario.es/politica/militares-policias-ayuso-montan-carrera-popular-decimo-aniversario-felipe-vi-ano-tarde_1_12360609.html,"Militares, policías de Madrid y Ayuso montan un año tarde una “carrera popular” por el X aniversario de Felipe VI",0
https://www.eldiario.es/comunitat-valenciana/sociedad/detenidos-seis-menores-pegar-palos-encapuchados-alumno-salida-colegio-valencia_1_12369297.html,Detenidos seis menores por agredir encapuchados y con palos a un alumno a la salida del colegio en València,0
https://www.eldiario.es/economia/calvino-calvino-bei-avanza-firmara-proximas-semanas-acuerdo-impulsar-interconexion-energetica-espana-francia_1_12369342.html,Calviño anuncia un acuerdo para impulsar la interconexión energética entre España y Francia,0
https://www.eldiario.es/internacional/fiscalia-colombiana-apunta-grupo-criminal-responsable-atentando-senador-uribe-turbay_1_12369809.html,La fiscalía colombiana apunta a un “grupo criminal” como responsable del atentando contra el senador Uribe Turbay,0
https://www.eldiario.es/economia/banco-espana-recorta-prevision-crecimiento-tres-decimas-2-4-2025-guerra-comercial_1_12369301.html,"El Banco de España recorta la previsión de crecimiento tres décimas al 2,4% en 2025 por la guerra comercial",0
https://www.eldiario.es/economia/elma-saiz-pide-no-azuzar-miedo-pensiones-confia-informe-airef-2026-sera-favorable_1_12370023.html,Elma Saiz pide no azuzar el miedo en las pensiones y confía en que el informe de la AIReF en 2026 será favorable,0
https://www.eldiario.es/edcreativo/ccoo-exigira-autonomia-estrategica-frente-transicion-digital-ecologica-demografica_1_12348674.html,"CCOO exigirá autonomía estratégica frente a la transición digital, la ecológica y la demográfica",0
https://www.eldiario.es/sociedad/aceleracion-azul-simplemente-depredacion-carrera-sacar-vez-recursos-mar_1_12360435.html,¿Aceleración azul o simplemente depredación? Así es la carrera por sacar cada vez más recursos del mar,0
https://www.eldiario.es/opinion/zona-critica/israel-flotilla-de-la-libertad-greta-thumberg-netanyahu-israel-matz-estados-unidos_129_12367190.html,Greta y sus amigos,0
https://www.eldiario.es/sociedad/enfermedades-transmision-sexual-siguen-disparadas-casos-gonorrea-suben-42-anos_1_11750392.html,Las enfermedades de transmisión sexual siguen disparadas: los casos de gonorrea suben un 42% en solo dos años,0
https://www.eldiario.es/sociedad/ayuso-garcia-no-quiero-besos-persona-llama-asesinos_1_12363671.html,Ayuso sobre García: “No quiero que me dé dos besos una persona que nos llama asesinos”,0
https://www.eldiario.es/politica/miles-personas-abarrotan-plaza-espana-madrid-protesta-pp-gobierno-sanchez_1_12366518.html,Miles de personas abarrotan la Plaza de España de Madrid en la protesta del PP contra el Gobierno de Sánchez,0
https://www.eldiario.es/politica/pp-espera-propuesta-primarias-feijoo-mirada-puesta-ayuso_1_12325552.html,El PP espera la propuesta de primarias de Feijóo con la mirada puesta en Ayuso,0
https://www.eldiario.es/politica/gobierno-duplica-presupuesto-becas-opositar-juez-fiscal-15-6-millones-euros_1_12312269.html,"El Gobierno duplica el presupuesto de las becas para opositar a juez y fiscal hasta los 15,6 millones de euros",0
https://www.eldiario.es/internacional/espana-destinara-ano-40-457-millones-gasto-militar-medio-punto-calcula-gobierno_1_12249225.html,"España destinará este año 40.457 millones a gasto militar, casi medio punto más de lo que calcula el Gobierno",0
https://www.eldiario.es/economia/milei-bano-masas-ultraliberal-madrid-dice-pais-libre-mundo_1_12367276.html,"Milei, en baño de masas ultraliberal en Madrid, dice que su país es el más libre de mundo",0
https://www.eldiario.es/rastreador/rufian-puente-recuperan-tuit-ayuso-defendia-lenguas-cooficiales_132_12369522.html,Óscar Puente y Rufián rescatan un tuit antiguo de Ayuso sobre las lenguas cooficiales: “¿Era de cuando llevaba la cuenta de Pecas?”,0
https://www.eldiario.es/sociedad/intestino-fosilizado-muestra-grandes-dinosaurios-tragaban-cantidades-colosales-comida-masticar_1_12368712.html,Restos fósiles revelan que los grandes dinosaurios tragaban cantidades colosales de comida sin masticar,0
https://www.eldiario.es/cultura/libros/muere-novelista-britanico-superventas-frederick-forsyth-autor-dia-chacal-86-anos_1_12369942.html,"Muere el novelista británico superventas Frederick Forsyth, autor de 'El día del chacal', a los 86 años",0
https://www.eldiario.es/edcreativo/aumenta-preocupacion-riesgo-sufrir-emergencias-hogar_1_12358397.html,Aumenta la preocupación ante el riesgo de sufrir emergencias en el hogar,0
https://www.eldiario.es/sevilla/vertidos-guadiamar-guadalquivir-volantazo-dio-mina-aznalcollar-luz-verde-ambiental_1_12352468.html,"Del Guadiamar al Guadalquivir, el volantazo que dio la mina de Aznalcóllar a sus vertidos para tener licencia ambiental",0
https://www.eldiario.es/opinionsocios/15-junio-toma-conciencia-abuso-maltrato-vejez_132_12353539.html,15 de junio:Toma de conciencia del abuso y el maltrato en la vejez,0
https://www.eldiario.es/cultura/actor-harry-potter-tom-felton-expresa-apoyo-anti-trans-j-k-rowling_1_12369295.html,El actor de 'Harry Potter' Tom Felton expresa su apoyo a J.K. Rowling pese a sus opiniones antitrans,0
https://www.eldiario.es/vertele/noticias/serie-harry-potter-max-confirma-nueve-actores-draco-lucius-malfoy-dursley_1_12369823.html,Max La serie de 'Harry Potter' en Max confirma a nueve actores más: de Draco y Lucius Malfoy a los Dursley,0
https://www.eldiario.es/vertele/audiencias-tv/la-familia-de-la-tele-rtve-un-mes-despues-radiografia-convulso-inicio-vivido-nuevo-salvame_1_12355670.html,"'La familia de la tele', un mes después: radiografía del convulso inicio que ha vivido el nuevo 'Sálvame' en RTVE",0
https://www.eldiario.es/comunitat-valenciana/sms-recibia-cupula-autonomica-emergencias-alertaron-presa-forata-no-barranco-poyo_1_12370015.html,Los SMS automáticos que Emergencias envió en la DANA a sus altos cargos no alertaron del barranco del Poyo,0
https://www.eldiario.es/comunitat-valenciana/grabaciones-seguridad-llamadas-trayectos-factura-ventorro-incognitas-mazon-siete-meses-dana_1_12358713.html,"Grabaciones de seguridad, llamadas, trayectos y ticket del Ventorro: las lagunas de Mazón siete meses tras la DANA",0
https://www.eldiario.es/navarra/jon-aldalur-exmiembro-eta-arrepentido-no-supimos-parar-monstruo-habiamos-creado_1_12359004.html,"Jon Aldalur, exmiembro de ETA arrepentido: “No supimos parar el monstruo que habíamos creado”",0
https://www.eldiario.es/galicia/cronologia-denuncia-agresion-sexual-sacude-gobierno-xunta-galicia_1_12363226.html,Cronología de una denuncia por agresión sexual que sacude al Gobierno de la Xunta de Galicia,0
https://www.eldiario.es/andalucia/granada/juez-investiga-diputado-pp-andalucia-compra-fraudulenta-finca-alcalde_1_12362434.html,Un juez investiga a un diputado andaluz del PP por “prevaricar” en la compra de una finca cuando era alcalde en Granada,0
https://www.eldiario.es/politica/socios-piden-gobierno-acelerar-plan-regeneracion-democratica-sigue-atascado-congreso_1_12344736.html,Los socios piden al Gobierno acelerar el plan de regeneración democrática que sigue atascado en el Congreso,0
https://www.eldiario.es/socios/disponible-version-digital-nueva-revista-amor-moderno_132_12351699.html,Disponible en versión digital la nueva revista 'El poder del amor moderno',0
https://www.eldiario.es/socios/entra-gratis-fiesta-festival-musica-grande-cantabria_132_12298429.html,Entra gratis a la fiesta del festival 'Música en Grande' en Cantabria,0
https://www.eldiario.es/sociedad/espana-protegera-guarderia-cachalotes-norte-menorca_1_12369237.html,España protegerá la 'guardería' de cachalotes al norte de Menorca,0
https://www.eldiario.es/illes-balears/politica/govern-paralizo-procedimiento-sancionador-proceso-judicial-no-impide-mantener-medidas-cautelares_1_12367548.html,"Los técnicos del Govern balear alertaron en noviembre sobre la 'granja de los horrores', pero siguió en funcionamiento",0
https://www.eldiario.es/sociedad/longevidad-premium-embriones-empresa-ofrece-concebir-ninos-vivan-85-anos_1_12360431.html,Longevidad ‘premium’ para embriones: una empresa ofrece concebir niños que vivan mucho más allá de 85 años,0
https://www.eldiario.es/andalucia/gobierno-confirma-muerte-mujer-marbella-asesinato-violencia-genero-13o-ano_1_12367870.html,El Gobierno confirma como asesinato por violencia de género la muerte de una mujer en Marbella,0
https://www.eldiario.es/andalucia/almeria/principal-desaladora-almeria-vilo-agricultores-recrudece-disputa-control-agua_1_12322091.html,La principal desaladora de Almería tiene en vilo a miles de agricultores mientras se aviva la lucha por el control del agua,0
https://www.eldiario.es/comunitat-valenciana/cerradas-preventivamente-playas-daimus-miramar-bellreguard-piles-guardamar-vertido_1_12369309.html,Cerradas preventivamente las playas del sur de Valencia por un vertido de origen desconocido,0
https://www.eldiario.es/murcia/sociedad/cartagena-elude-memoria-historica-indigno-pleno-2025-haya-decenas-calles-ensalzan-franquismo_1_12361196.html,Cartagena elude la Memoria Histórica: “Es indigno que en pleno 2025 haya decenas de calles que ensalzan el franquismo”,0
https://www.eldiario.es/edcreativo/diario-salud/jovenes-e-infecciones-transmision-sexual-frenar-problema-aumento_1_12342826.html,"Jóvenes e infecciones de transmisión sexual, cómo frenar un problema que va en aumento",0
https://www.eldiario.es/edcreativo/congreso-fundraising-da-voz-ong-retos-desinformacion-ia_1_12363649.html,El Congreso de Fundraising da voz a las ONG ante los retos de la desinformación y la IA,0
https://www.eldiario.es/economia/elma-saiz-compromete-ingreso-minimo-vital-llegue-40-hogares-ninos_1_12368747.html,El ingreso mínimo vital cumple cinco años con el objetivo de llegar a un 40% más de hogares con niños en 2027,0
https://www.eldiario.es/economia/cambiaria-sistema-electrico-espana-baterias-cubrir-28-demanda-nocturna_1_12360562.html,¿Cómo cambiaría el sistema eléctrico en España con baterías? Así podrían cubrir hasta un 28% de la demanda nocturna,0
https://www.eldiario.es/economia/glovo-dice-abandonara-riders-autonomos-1-julio-medio-causas-judiciales_1_12369296.html,Glovo dice que todos sus 'riders' serán asalariados desde el 1 de julio cercada por varias causas judiciales,0
https://www.eldiario.es/economia/carlos-cuerpo-gobernar-presupuestos-seguimos-creciendo_1_12358962.html,Carlos Cuerpo: “Se puede gobernar sin Presupuestos porque seguimos creciendo”,0
https://www.eldiario.es/economia/oro-dolares-banco-espana-problema-patrimonio-frente-resto-bancos-centrales-zona-euro_1_12360654.html,"Ni oro, ni dólares: el Banco de España tiene un problema de solvencia frente al resto de la zona del euro",0
https://www.eldiario.es/viajes/monasterio-oculto-segovia-abre-puertas-despues-600-anos-clausurado-pm_1_12370156.html,El monasterio oculto de Segovia abre sus puertas después de 600 años clausurado,0
https://www.eldiario.es/euskadi/andar-en-bici/rutas/tres-rutas-descubrir-cuadrilla-anana-joya-salada-alava_1_12367828.html,"Tres rutas para descubrir la cuadrilla de Añana, la joya salada de Álava",0
https://www.eldiario.es/tecnologia/ponlo-chatgpt-trabajadores-perdieron-empleos-culpa-ia_1_12363821.html,“Ponlo en ChatGPT”: los trabajadores que perdieron sus empleos por culpa de la IA,0
https://www.eldiario.es/internacional/gaza-cisjordania-netanyahu-radicaliza-gobierno-israel-dirige-ultra-extrema-derecha_1_12360260.html,Por qué Netanyahu ha adoptado la agenda de la ultraderecha: “Su partido está pasando a ser de corte fascista”,0
https://www.eldiario.es/internacional/rusia-ucrania-efectuan-nuevo-intercambio-prisioneros-guerra-mayor-ataque-drones-fuerzas-putin_1_12368635.html,Rusia y Ucrania efectúan un nuevo intercambio de prisioneros tras el mayor ataque con drones de las fuerzas de Putin,0
https://www.eldiario.es/internacional/alta-abstencion-defendia-meloni-evita-aprueben-referendum-nacionalidad-derechos-laborales-italia_1_12369248.html,"Los referéndum sobre nacionalidad y derechos laborales rechazados por Meloni en Italia, invalidados por falta de quórum",0
https://www.eldiario.es/internacional/cobrar-triple-pasaportes-solucion-diplomaticos-problemas-financiacion-servicio-exterior_1_12356205.html,Multiplicar por cuatro el precio del pasaporte: la propuesta de los diplomáticos ante la falta de financiación en consulados,0
https://www.eldiario.es/blog/al-dia/podcast-mujeres-feminismo-nueva-ola-internet_132_12364029.html,🎙 PODCAST | Mujeres contra el feminismo: nueva ola en Internet,0
https://www.eldiario.es/cultura/la-trama/podcast-lectura-1-relato-lola-lopez-mondejar_1_12337752.html,"🎙️ PODCAST | Lectura 1: 'Sin relato', de Lola López Mondéjar",0
https://www.eldiario.es/catalunya/cultura/kneecap-convierte-sala-apolo-olla-presion-genocidio-palestino-cierre-primavera-sound-2025_1_12367395.html,Kneecap convierte la sala Apolo en una olla a presión contra el genocidio palestino en el cierre del Primavera Sound,0
https://www.eldiario.es/escolar/cuentas-2022-paga-sueldos-eldiario_132_10500632.html?itm_n=caja-home&itm_c=cuentas,Las cuentas de 2022: quién paga los sueldos de elDiario.es,0
https://www.eldiario.es/cultura/musica/tropelias-alice-bag-punk-chicana-reivindica-punk-angeles-latino-queer_1_12361512.html,"Las “tropelías” de Alice Bag, la chicana que reivindica que el punk de Los Ángeles también fue latino y queer",0
https://www.eldiario.es/cultura/libros/poemas-palestina-fanzine-desafia-reglas-capitalistas-mundo-editorial_1_12361476.html,"'Poemas de y por Palestina', el fanzine que desafía las reglas capitalistas del mundo editorial",0
https://www.eldiario.es/cultura/cine/diario-inedito-ivan-zulueta-sirve-desvelar-mito-misterioso-cine-espanol_1_12363814.html,El diario inédito de Iván Zulueta que sirve para desvelar el mito más misterioso del cine español,0
https://librotea.eldiario.es/estanterias/literatura-reparacion-libros-autores-cambian-relato-historico,Literatura y reparación: libros y autores que cambian el relato histórico,0
https://www.eldiario.es/viajes/junio-mejor-mes-cerdena-corcega-sicilia_1_12354400.html,"Por qué junio es el mejor mes para ir a Cerdeña, Córcega o Sicilia",0
https://www.eldiario.es/viajes/stonehenge-espana-marea-cubrio-siglos-pm_1_12360115.html,El 'stonehenge' de España que la marea cubrió por siglos,0
https://elpais.com/economia/2025-06-09/el-banco-de-espana-rebaja-en-tres-decimas-el-crecimiento-para-este-ano-hasta-el-24.html,"El Banco de España rebaja en tres décimas el crecimiento para este año hasta el 2,4%",0
https://cincodias.elpais.com/companias/2025-06-09/zegona-se-dispara-en-bolsa-por-el-posible-interes-de-telefonica-en-comprar-vodafone.html,Zegona se dispara en Bolsa por el posible interés de Telefónica en comprar Vodafone,0
https://cincodias.elpais.com/companias/2025-06-09/la-audiencia-nacional-ordena-la-busca-y-captura-de-al-qubaisi-por-la-reventa-de-la-torre-cepsa.html,La Audiencia Nacional ordena la busca y captura de Al Qubaisi por la reventa de la Torre Cepsa,0
https://cincodias.elpais.com/companias/2025-06-09/sabemos-que-no-es-una-buena-noticia-una-comercializadora-de-repsol-comunica-ya-los-recargos-por-el-apagon.html,“Sabemos que no es una buena noticia”: una comercializadora de Repsol comunica ya los recargos por el apagón,0
https://cincodias.elpais.com/companias/2025-06-09/mango-aprueba-transformarse-en-sociedad-anonima-pese-a-descartar-por-ahora-su-salida-a-bolsa.html,Mango aprueba transformarse en sociedad anónima pese a descartar por ahora su salida a Bolsa,0
https://cincodias.elpais.com/companias/2025-06-09/la-banca-mantiene-viva-la-batalla-judicial-por-la-devolucion-de-los-gastos-hipotecarios.html,La banca mantiene viva la batalla judicial por la devolución de los gastos hipotecarios,0
https://cincodias.elpais.com/mercados-financieros/2025-06-09/la-bolsa-y-el-ibex-35.html,El Ibex cierra en tablas en una sesión de dudas ante las negociaciones entre EE UU y China,0
https://cincodias.elpais.com/companias/2025-06-09/llyc-adquiere-el-60-de-digital-solvers-para-ampliar-su-oferta-de-servicios-en-brasil.html,LLYC adquiere el 60% de Digital Solvers para ampliar su oferta de servicios en Brasil,0
https://elpais.com/economia/2025-06-09/elma-saiz-sobre-la-sostenibilidad-de-las-pensiones-no-hay-un-numero-magico.html,"Elma Saiz, sobre la sostenibilidad de las pensiones: “No hay un número mágico”",0
https://cincodias.elpais.com/companias/2025-06-09/el-greenwashing-de-las-etiquetas-de-la-dgt-coches-contaminantes-con-distintivo-cero-e-hibridos-que-no-se-mueven-en-electrico.html,El ‘greenwashing’ de las etiquetas de la DGT: coches contaminantes con distintivo cero e híbridos que no se mueven en eléctrico,0
https://elpais.com/economia/2025-06-09/calvino-se-abre-a-que-el-bei-multiplique-la-financiacion-a-proyectos-de-defensa-y-seguridad.html,Calviño se abre a que el BEI multiplique la financiación a proyectos de defensa y seguridad,0
https://cincodias.elpais.com/companias/2025-06-09/warner-bros-discovery-separa-su-negocio-de-streaming-y-produccion-de-sus-canales-de-television-por-cable.html,Warner Bros Discovery separa su negocio de ‘streaming’ y producción de sus canales de televisión por cable,0
https://elpais.com/economia/2025-06-09/glovo-asegura-que-todos-sus-repartidores-seran-asalariados-desde-el-1-de-julio.html,Glovo asegura que todos sus repartidores serán asalariados desde el 1 de julio,0
https://cincodias.elpais.com/mercados-financieros/2025-06-09/jefferies-apuesta-por-la-banca-domestica-y-eleva-con-fuerza-el-precio-objetivo-de-caixabank-bankinter-y-unicaja.html,"Jefferies apuesta por la banca doméstica y eleva con fuerza el precio objetivo de CaixaBank, Bankinter y Unicaja",0
https://elpais.com/espana/catalunya/2025-06-09/eficiencia-arraigo-y-libre-competencia-el-choque-de-argumentos-a-favor-y-en-contra-de-la-opa-al-sabadell.html,"Eficiencia, arraigo y libre competencia: el choque de argumentos a favor y en contra de la opa al Sabadell",0
https://cincodias.elpais.com/companias/2025-06-09/caf-gana-un-contrato-en-taiwan-de-200-millones-asociada-al-grupo-malasio-gamuda.html,CAF gana un contrato en Taiwán de 200 millones asociada al grupo malasio Gamuda,0
https://elpais.com/economia/2025-06-09/cinco-anos-del-ingreso-minimo-tres-millones-de-beneficiados-pese-a-que-muchos-se-quedan-fuera.html,Cinco años del ingreso mínimo: tres millones de beneficiados pese a que muchos se quedan fuera,0
https://cincodias.elpais.com/companias/2025-06-09/carrefour-superara-las-100-aperturas-en-espana-en-2025-la-mayoria-franquiciadas-y-ninguna-sera-un-hipermercado.html,Carrefour superará las 100 aperturas en España en 2025: la mayoría franquiciadas y ninguna será un hipermercado,0
https://cincodias.elpais.com/companias/2025-06-09/las-aplicaciones-de-ia-generativa-ven-su-trafico-multiplicarse-por-10-en-un-solo-trimestre.html,Las aplicaciones de IA Generativa ven su tráfico multiplicarse por 10 en un solo trimestre,0
https://cincodias.elpais.com/companias/2025-06-09/arriaga-cierra-con-pemberton-el-acuerdo-y-encara-el-final-del-concurso-de-acreedores.html,Arriaga cierra con Pemberton el acuerdo y encara el final del concurso de acreedores,0
https://cincodias.elpais.com/extras/transformacion-empresarial-e-ia/2025-06-05/luis-sanz-ibm-consulting-el-uso-de-agentes-de-ia-no-es-una-opcion-el-que-tarde-en-adoptarlos-tendra-un-problema-de-competitividad.html,Luis Sanz (IBM Consulting): “El uso de agentes de IA no es una opción; el que tarde en adoptarlos tendrá un problema de competitividad”,0
https://cincodias.elpais.com/companias/2025-06-09/la-salsa-japonesa-que-adora-hailey-bieber-y-que-ha-pasado-de-facturar-35000-dolares-a-100-millones-en-seis-anos.html,La salsa japonesa que adora Hailey Bieber y que ha pasado de facturar 35.000 dólares a 100 millones en seis años,0
https://cincodias.elpais.com/companias/2025-06-09/renfe-cubre-el-precio-de-parte-de-su-consumo-electrico-con-sonnedix-dentro-de-un-plan-para-ahorrar-costes.html,Renfe cubre el precio de parte de su consumo eléctrico con Sonnedix dentro de un plan para ahorrar costes,0
https://cincodias.elpais.com/mercados-financieros/2025-06-09/la-aerolinea-wizz-air-prolonga-su-sangria-en-bolsa-y-amplia-las-caidas-al-32-en-tres-sesiones.html,La aerolínea Wizz Air prolonga su sangría en Bolsa y pierde un tercio de su valor en tres jornadas,0
https://elpais.com/economia/2025-06-02/ya-se-puede-hacer-la-declaracion-de-la-renta-de-forma-presencial-como-pedir-cita-en-la-agencia-tributaria.html,Ya se puede hacer la declaración de la renta de forma presencial: cómo pedir cita en la Agencia Tributaria,0
https://elpais.com/economia/2025-05-15/hay-que-declarar-en-la-renta-los-bizums-entre-amigos.html,¿Hay que declarar en la renta los ‘bizums’ entre amigos?,0
https://cincodias.elpais.com/declaracion-renta/2025-04-02/claves-para-la-declaracion-de-la-renta-2024-todo-lo-que-debe-saber-el-contribuyente.html,Claves para la declaración de la renta 2024: todo lo que debe saber el contribuyente,0
https://cincodias.elpais.com/declaracion-renta/2025-03-29/guia-para-el-inversor-ante-la-renta-2024-todo-lo-que-necesita-saber-para-presentar-la-declaracion.html,Guía para el inversor ante la renta 2024: todo lo que necesita saber para presentar la declaración,0
https://cincodias.elpais.com/declaracion-renta/2025-03-29/asi-se-puede-sacar-partido-fiscal-de-las-aportaciones-a-planes-de-pensiones-en-la-declaracion-de-la-renta.html,Así se puede sacar partido fiscal de las aportaciones a planes de pensiones en la declaración de la renta,0
https://elpais.com/economia/2025-03-18/calendario-de-la-declaracion-de-la-renta-cuando-empieza-la-campana-del-irpf-y-como-pedir-cita.html,Calendario de la declaración de la renta 2024: hasta cuándo se puede presentar el IRPF y cómo pedir cita,0
https://elpais.com/economia/2025-03-19/desde-hoy-estan-disponibles-los-datos-fiscales-para-hacer-la-declaracion-de-la-renta-como-y-donde-consultarlos.html,Ya están disponibles los datos fiscales para hacer la renta: cómo y dónde consultar el borrador,0
https://cincodias.elpais.com/declaracion-renta/2025-03-27/parejas-casadas-es-mejor-hacer-la-declaracion-de-la-renta-conjunta-o-individual.html,Las parejas casadas en las que un cónyuge cobre menos de 3.400 euros al año se beneficiarán de hacer la renta conjunta,0
https://elpais.com/economia/2025-03-12/como-declarar-la-vivienda-en-la-renta-de-2024-claves-para-tributar-por-el-alquiler-la-compra-o-la-propiedad-de-una-casa.html,"Cómo declarar la vivienda en la renta de 2024: claves para tributar por el alquiler, la compra o la propiedad de una casa",0
https://cincodias.elpais.com/declaracion-renta/2025-03-14/renta-2024-como-declarar-las-ayudas-al-coche-electrico-y-que-deducciones-tengo.html,Renta 2024: cómo declarar las ayudas al coche eléctrico y qué deducciones tengo,0
https://cincodias.elpais.com/criptoactivos/2025-03-20/claves-para-declarar-las-criptomonedas-en-la-renta-hay-que-incluir-las-que-tengo-en-plataformas-extranjeras.html,Claves para declarar las criptomonedas en la renta: ¿hay que incluir las que tengo en plataformas extranjeras?,0
https://cincodias.elpais.com/companias/2025-06-03/el-efimero-sueno-de-un-hotelero-malagueno-que-quiso-hacer-cruceros-de-lujo.html,El efímero sueño de un hotelero malagueño que quiso hacer cruceros de lujo,0
https://cincodias.elpais.com/companias/2025-06-02/las-marcas-de-coches-chinas-se-despedazan-en-el-mercado-local-con-ofertas-imposibles-y-dejan-en-fuera-de-juego-al-resto.html,Las marcas de coches chinas se despedazan en el mercado local con ofertas imposibles y dejan en fuera de juego al resto,0
https://cincodias.elpais.com/mercados-financieros/2025-06-02/ultima-llamada-al-ahorro-conservador-para-conseguir-una-rentabilidad-del-3.html,Última llamada al ahorro conservador para conseguir una rentabilidad del 3%,0
https://cincodias.elpais.com/mercados-financieros/2025-06-02/calendario-veraniego-de-dividendos-para-junio-telefonica-ferrovial-y-otras-nueve-companias-reparten-a-sus-accionistas.html,"Calendario veraniego de dividendos para junio: Telefónica, Ferrovial y otras nueve compañías reparten a sus accionistas",0
https://cincodias.elpais.com/criptoactivos/2025-06-05/la-empresa-cripto-circle-se-dispara-un-230-en-su-debut-en-wall-street.html,La empresa cripto Circle se dispara un 168% en su debut en Wall Street,0
https://cincodias.elpais.com/criptoactivos/2025-06-05/el-usuario-de-binance-en-espana-hombre-de-entre-26-y-45-anos-autonomo-y-con-inversion-a-largo-plazo-en-criptos.html,"El usuario de Binance en España: hombre, de entre 26 y 45 años, autónomo y con inversión a largo plazo en criptos",0
https://cincodias.elpais.com/criptoactivos/2025-06-04/trump-media-a-un-paso-de-lanzar-su-etf-de-bitcoin.html,"Trump Media, a un paso de lanzar su ETF de bitcoin",0
https://cincodias.elpais.com/criptoactivos/2025-06-03/la-tokenizacion-inmobiliaria-llega-a-arabia-saudi.html,La tokenización inmobiliaria llega a Arabia Saudí,0
https://cincodias.elpais.com/criptoactivos/2024-10-22/glosario-cripto-guia-completa-para-entender-el-mundo-de-los-activos-digitales.html,Glosario cripto: guía completa para entender el mundo de los activos digitales,0
