url,title,is_clickbait
https://www.lavanguardia.com/deportes/tenis/20250609/10767966/alcaraz-sinner-rolando-garros-final-paris.html,¿El mejor partido de la historia? Siempre esa misma historia,0
https://www.lavanguardia.com/deportes/20250609/10770255/alcaraz-diez-profesional.html,“¿Alcaraz? Un diez como profesional”,0
https://www.lavanguardia.com/deportes/tenis/20250609/10768265/revista-prensa-mundo-rinde-alcaraz-verdadero-milagro-clase-voluntad-roland-garros-sinner.html,El mundo se rinde a Alcaraz: “Un verdadero milagro de clase y voluntad”,0
https://www.lavanguardia.com/vida/20250609/10768216/macron-trump-conozcamos-oceano-marte.html,Macron a Trump: “Conozcamos el océano antes que Marte”,0
https://www.lavanguardia.com/economia/20250609/10769363/nadia-calvino-bei-margen-invertir-mas-seguridad-defensa.html,"Nadia Calviño: ""El BEI tiene margen para invertir más en seguridad y defensa""",0
https://www.lavanguardia.com/local/20250528/10730456/como-gestionar-elturismo-perder-elalma-ciudad.html,Cómo gestionar el turismo sin perder el alma de la ciudad,0
https://www.lavanguardia.com/economia/20250609/10768558/foment-celebra-generalitat-presente-ampliacion-aeropuerto-barcelona.html,Foment celebra que la Generalitat presente al fin la ampliación del aeropuerto de Barcelona,0
https://www.lavanguardia.com/local/barcelona/20250609/10763633/renta-per-capita-sarria-sant-gervasi-duplica-ciutat-vella-nou-barris.html,La renta per cápita de Sarrià-Sant Gervasi duplica la de Ciutat Vella y Nou Barris,0
https://www.lavanguardia.com/local/tarragona/20250609/10770818/port-aventura-celebra-30-anos-estreno-espectaculo-drones.html,Port Aventura celebra 30 años con el estreno de un espectáculo con drones,0
https://www.lavanguardia.com/local/valencia/20250609/10759038/explosion-hotelera-valencia-40-licencias-2-500-plazas-marcha.html,Explosión hotelera en València: hasta 40 licencias para 2.500 plazas en marcha,0
https://www.lavanguardia.com/local/valencia/20250609/10767103/azorin-memoria-rescatada-alicante-redescubre-genio-98.html,"Azorín, la memoria rescatada: Alicante redescubre a su genio del 98",0
https://www.lavanguardia.com/local/valencia/20250608/10766764/detenida-abofetear-profesora-hija-colegio-torrent.html,Detenida por abofetear a la profesora de su hija en un colegio de Torrent,0
https://www.lavanguardia.com/local/madrid/20250609/10768994/ccoo-ugt-madrid-exigen-mas-prevencion-riesgos-evitar-accidentes-laborales.html,CCOO y UGT Madrid exigen más prevención de riesgos para evitar accidentes laborales,0
https://www.lavanguardia.com/local/madrid/20250609/10768199/seis-personas-son-rociadas-gas-pimienta-restaurante-plaza-toros-ventas.html,Seis personas son rociadas con gas pimienta en un restaurante junto a la plaza de toros de Ventas,0
https://www.lavanguardia.com/local/madrid/20250609/10769163/madrid-acogera-carrera-popular-x-aniversario-proclamacion-felipe-vi-agenciaslv20250609.html,Madrid acogerá una carrera popular por el X aniversario de la proclamación de Felipe VI,0
https://www.lavanguardia.com/deportes/fc-barcelona/20250609/10769340/lamine-yamal-jugador-mas-caro-mundo-valor-mercado-200-millones.html,Lamine Yamal ya es el jugador más caro del mundo,0
https://www.lavanguardia.com/servicios/obituarios/20250609/10770805/muere-sly-stone-revolucionario-funk-82-anos.html,"Muere Sly Stone, el revolucionario del funk, a los 82 años",0
https://www.lavanguardia.com/comer/al-dia/20250609/10735309/empresa-catalana-dado-vuelta-mundo-gracias-cubitera-flexible.html,La empresa catalana que ha dado la vuelta al mundo gracias a una cubitera flexible,0
https://www.lavanguardia.com/vida/20250605/10757833/plan-evitar-10-000-muertes-ultimos-tres-anos-calor-extremo.html,Plan para evitar las casi 10.000 muertes de los últimos tres años por el calor extremo,0
https://www.lavanguardia.com/local/baleares/20250609/10768351/sancionados-intentar-montar-fiesta-beach-club-playa-virgen-mallorca.html,Sancionados por intentar montar una fiesta con 'beach club' en una playa virgen de Mallorca,0
https://www.lavanguardia.com/vida/20250609/10768736/campana-sobre-its-parecia-tuviera-sifilis-hicimos-confie.html,Campaña sobre las ITS. “No parecía que tuviera sífilis y lo hicimos sin nada. Confié”,0
https://www.lavanguardia.com/natural/20250609/10766687/video-capta-nacimiento-cria-delfin-zoo-chicago-vdd.html,Un vídeo capta el nacimiento de una cría de delfín en el zoo de Chicago,0
https://www.lavanguardia.com/magazine/20250609/10758917/vive-verano-estilo-seleccion-imprescindibles-tus-marcas-preferidas-brl.html,Vive un verano con estilo con esta selección de imprescindibles de tus marcas preferidas,0
https://www.lavanguardia.com/deportes/20250609/10770045/egoitz-bijueska-14-anos-campeon-mundo-skateboarding.html,"Egoitz Bijueska, de 14 años, campeón del mundo de skateboarding",0
https://www.lavanguardia.com/vida/20250609/10769890/nuevo-escandalo-clinica-fertilidad-paises-bajos-36-donantes-engendraron-1-200-hijos.html,Nuevo escándalo en una clínica de fertilidad de Países Bajos: 36 donantes engendraron 1.200 hijos,0
https://www.lavanguardia.com/internacional/20250609/10770367/reino-unido-investiga-como-deportado-huyo-corriendo-pistas-heathrow.html,Reino Unido investiga cómo un deportado huyó corriendo por las pistas de Heathrow,0
https://www.lavanguardia.com/fotos/20250609/10770370/continuan-protestas-angeles-dolor-palestina-retienen-greta-thunberg.html,"Continuan las protestas en Los Ángeles, el dolor en Palestina,la retención de Greta Thunberg y otras imágenes del día",0
https://www.lavanguardia.com/cultura/20250609/10768831/hallada-turquia-tumba-miembro-familia-real-frigia-emparentado-mitico-rey-midas-convertia-oro-tocaba.html,"Hallada en Turquía la tumba de un miembro de la familia real frigia emparentado con el mítico rey Midas, que convertía en oro lo que tocaba",0
https://www.lavanguardia.com/cultura/20250609/10770587/isabel-coixet-thyssen-collage-exposicion.html,"Isabel Coixet expone en el Thyssen: “Siento que soy una absoluta impostora, pero soy una persona que está muy cómoda siendo una impostora”",0
https://www.lavanguardia.com/vida/20250604/10744900/sostenibilidad-centro-estrategia-corporativa-brl.html,La sostenibilidad en el centro de la estrategia corporativa,0
https://www.lavanguardia.com/lacontra/20250609/10767430/marta-milla-acaba-gusanos-hay-mas-mas.html,"Marta Millà, actriz, psicoterapeuta, escritora: “No todo se acaba con los gusanos: hay más, ¡mucho más!”",0
https://www.lavanguardia.com/ciencia/20250609/10762710/ia-justicia-combinacion-exige-prudencia-responsabilidad.html,"IA y Justicia: una combinación que exige prudencia y responsabilidad, por Ramón López de Mántaras",0
https://www.lavanguardia.com/opinion/20250609/10766745/centro-atencion.html,"Ser el centro de atención, por Jaume Pi",0
https://www.lavanguardia.com/politica/20250609/10767288/amnistia-democracia.html,"Amnistía y democracia, por Iván Redondo",0
https://www.lavanguardia.com/local/barcelona/20250609/10765588/sindrome-catalan-quinto-pino.html,"El síndrome catalán del quinto pino, por Enric Sierra",0
https://www.lavanguardia.com/comprar/rebajas-ofertas/20250609/10761001/chollos-dia-amazon-9-junio-25-69-descuento.html,Los chollos del día en Amazon (9 de junio): entre el 25% y el 69% de descuento,0
https://www.lavanguardia.com/vida/20250609/10763139/como-presentar-reclamacion-servicio-producto-defectuoso.html,Cómo presentar una reclamación por un servicio o un producto defectuoso,0
https://www.lavanguardia.com/historiayvida/historia-contemporanea/20250609/10761378/noventa-anos-sobrios-historia-alcoholicos-anonimos.html,Noventa años sobrios: la historia de Alcohólicos Anónimos,0
https://www.lavanguardia.com/seguros/20250609/10761940/debo-permiso-hoguera-vender-petardos-san-juan.html,¿Debo tener un permiso para hacer una hoguera o vender petardos en San Juan?,0
https://www.lavanguardia.com/opinion/20250609/10767423/preservar-exito-primavera-sound.html,"Preservar el éxito del Primavera Sound, por Editorial",0
https://www.lavanguardia.com/opinion/20250609/10767575/hipnotizados.html,"Hipnotizados, por Lola García",0
https://www.lavanguardia.com/opinion/20250609/10767228/ayuso-gallina-caponata.html,"Ayuso y la gallina Caponata, por Jordi Basté",0
https://www.lavanguardia.com/opinion/20250609/10767118/mala-educacion.html,"La mala educación, por Antoni Puigverd",0
https://www.lavanguardia.com/internacional/20250609/10767404/presidentes-enfermos-ignorancia-popular.html,"Presidentes enfermos, ignorancia popular, por Juan M. Hernández Puértolas",0
https://www.lavanguardia.com/opinion/20250609/10767123/regresion-estupidez.html,"Regresión y estupidez, por Carles Casajuana",0
https://www.lavanguardia.com/opinion/20250609/10767127/quedarse.html,"Quedarse, por Mar Jiménez",0
https://www.lavanguardia.com/economia/20250609/10767366/estupida-politica-memetica.html,"Estúpida política memética, por Josep Maria Ganyet",0
https://www.lavanguardia.com/deportes/futbol/20250609/10767608/plurinations-league.html,"PluriNations League, por Sergi Pàmies",0
https://www.lavanguardia.com/opinion/20250609/10767124/lecciones-atletismo-politica.html,"Lecciones del atletismo para la política, por Antoni Gutiérrez-Rubí",0
https://www.lavanguardia.com/opinion/20250609/10767119/votantes-plim.html,"Votantes del PLIM, por Màrius Serra",0
https://www.lavanguardia.com/opinion/20250609/10767165/creadores-contenido.html,"Creadores de contenido, por Emilio del Río",0
https://www.lavanguardia.com/opinion/20250609/10767446/primavera-people.html,"Primavera People, por La Mirilla",0
https://www.lavanguardia.com/internacional/20250609/10770101/padre-elon-musk-quiere-aprender-putin-como-buen-lider.html,El padre de Elon Musk elogia a Putin en Moscú: “Me gustaría aprender de él cómo ser un buen líder”,0
https://www.lavanguardia.com/internacional/20250609/10769331/senador-uribe-turbay-continua-critico-maxima-gravedad.html,El senador Uribe Turbay continúa en estado crítico de “máxima gravedad”,0
https://www.lavanguardia.com/internacional/20250609/10735204/mexico-tiembla-ofertas-ayuda-trump-combatir-narcotrafico.html,"México tiembla ante las ofertas de ""ayuda"" de Trump para combatir el narco tráfico",0
https://www.lavanguardia.com/internacional/20250609/10769573/italia-deja-efecto-cinco-referendos-escasa-participacion.html,Italia deja sin efecto cinco referendos por escasa participación,0
https://www.lavanguardia.com/internacional/20250609/10768836/semana-decisiva-bolsonaro-comienza-juicio-caso-golpe.html,Semana decisiva para Bolsonaro: comienza el juicio del caso ‘golpe de Estado’,0
https://www.lavanguardia.com/politica/20250609/10767360/empatia-renuncias-nunca-aprobara-nueva-financiacion-consejeros-pp-terminaran-firmando-quita-deuda.html,Ángel Víctor Torres: “Sin empatía y renuncias nunca se aprobará la nueva financiación”,0
https://www.lavanguardia.com/local/valencia/20250609/10770672/compromis-rompe-sumar-pide-revaluar-acuerdo-sanchez-comparezca.html,Compromís no rompe con Sumar pero pide revaluar el pacto y que Sánchez comparezca,0
https://www.lavanguardia.com/local/madrid/20250609/10768975/oposicion-ayuso-rechaza-show-conferencia-presidentes-agenciaslv20250609.html,La oposición a Ayuso rechaza su “show” en la Conferencia de Presidentes,0
https://www.lavanguardia.com/politica/20250608/10765921/pasa.html,"No todo pasa en el Este, por Enric Juliana",0
https://www.lavanguardia.com/politica/20250608/10767486/milei-vuelve-madrid-insultos-bandido-sanchez-foro-economico-ultra.html,Milei vuelve a Madrid entre insultos al “bandido” Sánchez,0
https://www.lavanguardia.com/economia/20250609/10770709/saiz-reivindica-examen-pensiones-partir-aprobado-airef.html,Saiz reivindica el examen de las pensiones a partir del aprobado de la Airef,0
https://www.lavanguardia.com/economia/20250609/10769968/banco-espana-rebaja-tres-decimas-prevision-crecimiento-2-4.html,"El Banco de España rebaja en tres décimas la previsión de crecimiento, hasta el 2,4%, por los aranceles",0
https://www.lavanguardia.com/economia/20250609/10768426/china-compensa-dentellada-trump-mas-exportaciones-resto-mundo.html,China compensa el zarpazo de Trump con más exportaciones al resto del mundo,0
https://www.lavanguardia.com/economia/20250609/10770112/fedea-favor-ampliar-nucleares-2030.html,Fedea a favor de ampliar las nucleares al menos hasta 2030,0
https://www.lavanguardia.com/dinero/20250609/10770332/glovo-repartidores-contratar-contrato-modelo-1-julio.html,Glovo cambiará su modelo a uno con repartidores contratados el 1 de julio,0
https://www.lavanguardia.com/dinero/20250609/10769329/ohla-construira-54-millones-tres-nuevos-muelles-ferris-puerto-barcelona.html,OHLA construirá por 54 millones tres nuevos muelles para ferris en el puerto de Barcelona,0
https://www.lavanguardia.com/local/barcelona/20250609/10766382/sea-momento-pediremos-papa-inaugure-torre-jesus.html,“Cuando sea el momento pediremos al Papa que inaugure la Torre de Jesús”,0
https://www.lavanguardia.com/vida/20250609/10768522/detenido-mantero-dar-dos-navajazos-empleado-limpieza-cambrils.html,Detenido un hombre por dar dos navajazos a un empleado de la limpieza en Cambrils,0
https://www.lavanguardia.com/vida/20250609/10769967/pais-vasco-permitira-hospitalizados-lleven-mascotas.html,El País Vasco permitirá que los hospitalizados lleven a sus mascotas,0
https://www.lavanguardia.com/local/andalucia/20250609/10768229/dos-hombres-menor-dos-anos-mueren-ahogamiento-andalucia-apenas-tres-dias.html,Dos hombres y una menor de dos años mueren por ahogamiento en Andalucía en apenas tres días,0
https://www.lavanguardia.com/local/barcelona/20250609/10748148/ordenanza-civismo-barcelona-nudismo.html,Ordenanza de civismo: el día que Barcelona abrazó el nudismo,0
https://www.lavanguardia.com/deportes/futbol/20250608/10767586/portugal-espana-final-nations-league-resumen.html,España no es perfecta y cede ante Portugal en los penaltis,0
https://www.lavanguardia.com/deportes/futbol/20250609/10767609/sonrisas-cristiano-lagrimas-espana-volveremos-ganar-titulos-final-nations-league.html,"Sonrisas de Cristiano y lágrimas para España: ""Volveremos a ganar títulos""",0
https://www.lavanguardia.com/deportes/futbol/20250609/10770559/sanitarios-lucharon-hora-salvar-aficionado-precipito-final-nations-league.html,Los sanitarios lucharon una hora por salvar al aficionado que se precipitó en la final de la Nations League,0
https://www.lavanguardia.com/deportes/futbol/20250609/10769616/barca-confirma-lesion-roelfo-duda-eurocopa.html,El Barça confirma la lesión de Rolfö y es duda para la Eurocopa,0
https://www.lavanguardia.com/deportes/fc-barcelona/20250609/10770004/lenglet-rescinde-contrato-barca-ficha-atletico-madrid-2028-plan-de-fichajes-salidas.html,Lenglet rescinde su contrato con el Barça y ficha por el Atlético de Madrid hasta el 2028,0
https://www.lavanguardia.com/deportes/real-madrid/20250609/10770003/xabi-alonso-dirige-primer-entrenamiento-margen-preparar-mundial-clubs.html,Xabi Alonso dirige su primer entrenamiento sin margen para preparar el Mundial de Clubs,0
https://www.lavanguardia.com/deportes/rcde-espanyol/20250609/10767767/puado-elige-pildora-blanquiazul-renovacion.html,Puado resuelve sus dudas y renovará con el Espanyol,0
https://www.lavanguardia.com/deportes/20250609/10770409/estrategia-hormiga-marc-marquez.html,La estrategia de la hormiga de Marc Márquez,0
https://www.lavanguardia.com/deportes/ciclismo/20250609/10770046/jonathan-milan-emerge-marabunta-vestirse-amarillo.html,Jonathan Milan emerge entre la marabunta para vestirse de amarillo,0
https://www.mundodeportivo.com/futbol/fc-barcelona/20250607/1002478988/jong-trabaja-romper-agente.html?utm_medium=referral&amp;utm_source=mundodeportivo.com,De Jong trabaja para romper con su agente,0
https://www.mundodeportivo.com/elotromundo/television/20250607/1002479422/david-civera-muerde-lengua-habla-alto-claro-sobre-melody-eurovision-sido-justo-dct.html?utm_medium=referral&amp;utm_source=mundodeportivo.com,"David Civera no se muerde la lengua y habla alto y claro sobre Melody en Eurovisión: ""No ha sido justo""",0
https://www.lavanguardia.com/comprar/rebajas-ofertas/20250609/10745779/5-chollos-dia-aliexpress-9-junio-26-69-descuento-mkt-alie.html,Los 5 chollos del día en AliExpress (9 de junio): entre el 25% y el 69% de descuento,0
https://www.lavanguardia.com/comprar/hogar-cocina/20250609/10757056/tuvieras-elegir-ventilador-refrescar-casa-seria-colocarias-estancia-palabra-experta.html,Si tuvieras que elegir un solo ventilador para refrescar tu casa sería este y lo colocarías en esta estancia (palabra de experta),0
https://www.lavanguardia.com/comprar/moda-belleza/20250609/10752082/compactos-invisibles-eficaces-5-sticks-solares-seran-nuevo-imprescindible-verano.html,"Compactos, invisibles y eficaces: estos 5 sticks solares serán tu nuevo imprescindible del verano",0
https://www.lavanguardia.com/comprar/moda-belleza/20250609/10756494/minimalistas-frescas-elegantes-camisas-lino-hombre-son-rotundo.html,"Minimalistas, frescas y elegantes: estas camisas de lino para hombre son un sí rotundo",0
https://www.lavanguardia.com/comprar/moda-belleza/20250609/10758990/dockers-liquida-pantalones-mas-vendidos-hombre-mujer-descuentos-48-mkt-dock.html,Dockers liquida sus pantalones más vendidos para hombre y mujer con descuentos de hasta el -53%,0
https://www.eldiario.es/politica/juez-hurtado-procesa-fiscal-general-filtracion-correo-pareja-ayuso_1_12361758.html,El Supremo procesa al fiscal general por la filtración del correo de la pareja de Ayuso y le acusa sin pruebas de seguir “instrucciones” de Moncloa,0
https://www.eldiario.es/politica/audios-entregados-leire-diez-incluyen-conversaciones-cospedal-villarejo-fiscal-grinda-hay-matarlo_1_12367596.html,Los audios entregados por Leire Díez incluyen conversaciones de Cospedal con Villarejo: “Al fiscal Grinda hay que matarlo”,0
https://www.eldiario.es/extremadura/politica/jueza-acusa-gallardo-fraude-ley-aforamiento-pide-tsjex-decida-si-asume-causa_1_12367840.html,La jueza acusa a Gallardo de “fraude de ley” en su aforamiento y pide al Tribunal Superior de Extremadura que decida si asume la causa,0
https://www.eldiario.es/desalambre/trump-habla-liberar-angeles-invadido-migrantes-ilegales-california-denuncia-despliegue-guardia-nacional_1_12367430.html,Trump exige “que entren las tropas” en Los Ángeles mientras California denuncia el despliegue “ilegal” de la Guardia Nacional,0
https://www.eldiario.es/desalambre/policia-angeles-dispara-espalda-bala-goma-periodista-informaba-directo-protestas_1_12369284.html,Un policía dispara una bala de goma a una periodista mientras informaba en directo de las protestas en Los Ángeles,0
https://www.eldiario.es/vertele/noticias/reaccion-juan-carlos-rivero-ver-bandera-franquista-portugal-espana-aplaudida-presidente-rtve_1_12367716.html,"La reacción de Rivero al ver la bandera franquista en el Portugal-España, aplaudida por el presidente de RTVE",0
https://www.eldiario.es/castilla-la-mancha/politica/emiliano-garcia-page-no-convoca-elecciones-castilla-mancha-si-pedro-sanchez-no-espana_1_12368893.html,Por qué Page no adelanta elecciones para evitar que las autonómicas coincidan con unas generales,0
https://www.eldiario.es/comunitat-valenciana/agresion-sexual-multiple-colegio-concertado-valencia-presuntos-agresores-no-expulsados-victima-abandono-centro_1_12368790.html,Investigan una presunta agresión sexual en grupo en un colegio concertado de València,0
https://www.eldiario.es/sociedad/aemet-pone-siete-comunidades-alerta-tormentas-calor-aragon-aviso-naranja-granizadas_1_12367684.html,Aemet pone a siete comunidades en alerta por tormentas o calor y a Aragón en aviso naranja por granizadas,0
https://www.eldiario.es/sociedad/luna-llena-junio-2025-fresa_1_12352118.html,Luna llena junio Llega la Luna de Fresa: cuándo es el mejor momento para ver la luna llena de junio,0
https://www.eldiario.es/vertele/noticias/ayuso-carga-gonzalo-miro-plato-espejo-publico-vive-dias-insultarme-programa_1_12368523.html,Ayuso carga contra Gonzalo Miró desde el plató de 'Espejo Público': “Vive todos los días de insultarme en este programa”,0
https://www.eldiario.es/economia/tu-economia/oposiciones-junio-2025-son-nuevas-convocatorias-miles-plazas-empleo-publico_1_12362764.html,Oposiciones junio 2025: estas son las nuevas convocatorias con miles de plazas de empleo público,0
https://www.eldiario.es/madrid/somos/ayuntamiento-madrid-abrira-agujero-400-metros-cuadrados-plaza-mayor-arreglar-tunel-subterraneo_1_12367700.html,El Ayuntamiento de Madrid abrirá un agujero de 400 metros cuadrados en la Plaza Mayor para arreglar su túnel subterráneo,0
https://www.eldiario.es/sociedad/educacion/salen-notas-selectividad-2025-fechas-ccaa_1_12349567.html,PAU 2025 Cuándo salen las notas de la selectividad 2025: fechas de publicación en cada CCAA,0
https://www.eldiario.es/economia/tu-economia/calendario-declaracion-2024-fechas-renta-limite_1_12098319.html,Fechas Renta 2025 Calendario y fechas de la Declaración de la Renta 2024 - 2025,0
https://andaluciainforma.eldiario.es/tramites/julio-viene-con-el-transporte-publico-gratis-debajo-del-brazo-estos-son-los-andaluces-que-podran-beneficiarse/,Julio viene con el transporte público gratis debajo del brazo: estos son los andaluces que podrán beneficiarse,0
https://madridinforma.eldiario.es/curso-2025-26-la-comunidad-de-madrid-simplifica-y-refuerza-las-becas-de-formacion-profesional/,Curso 2025/26: la Comunidad de Madrid simplifica y refuerza las becas de Formación Profesional,0
https://www.eldiario.es/festival-de-las-ideas-y-la-cultura/,Festival de las ideas y la cultura 2025 de elDiario.es,0
https://www.eldiario.es/comunitat-valenciana/compromis-aplaza-decision-ruptura-sumar-falta-acuerdo-partidos-coalicion-valencianista_1_12368629.html,"Compromís propone cambiar su relación con Sumar, pero no abandona el grupo parlamentario",0
https://www.eldiario.es/opinion/zona-critica/saltos-vacio-tribunal-supremo-caso-fiscal-general_129_12369367.html,Los saltos al vacío del Tribunal Supremo en el caso del fiscal general,0
https://www.eldiario.es/politica/gobierno-fiscalia-descartan-dimision-garcia-ortiz-procesamiento-correo-pareja-ayuso_1_12368492.html,El Gobierno y la Fiscalía descartan la dimisión de García Ortiz tras su procesamiento por el Supremo,0
https://www.eldiario.es/politica/pp-pide-sanchez-explique-congreso-indicaciones-dieron-fiscal-general-presidencia-gobierno_1_12369858.html,El PP pide que Sánchez explique en el Congreso qué “indicaciones” se dieron al fiscal general “desde la Presidencia del Gobierno”,0
https://www.eldiario.es/internacional/trump-veria-detener-gobernador-california-oponerse-redadas-masivas-despliegue-guardia-nacional_1_12369909.html,Trump ve bien detener al gobernador de California mientras el Estado le denuncia por desplegar la Guardia Nacional en Los Ángeles,0
https://www.eldiario.es/internacional/theguardian/bernie-sanders-no-enfrentamos-partido-republicano-establishment-democrata_128_12358778.html,Bernie Sanders: “Está calando el mensaje de que es peligroso estar en contra de Donald Trump”,0
https://www.eldiario.es/internacional/mark-ruffalo-explota-trump-carta-clase-trabajadora-estadounidense-apuntando-no_1_12367852.html,Mark Ruffalo explota contra Trump en una carta para la clase trabajadora estadounidense: “Estáis apuntando a quien no es”,0
https://www.eldiario.es/internacional/flotilla-libertad-rumbo-gaza-denuncia-secuestro-madleen-interceptado-conducido-israel_1_12367444.html,El ejército israelí asalta la Flotilla de la Libertad rumbo a Gaza con Greta Thunberg a bordo,0
https://www.eldiario.es/internacional/israel-amenaza-activistas-flotilla-libertad-llevarlos-centro-detencion-si-no-aceptan-irse-inmediatamente_1_12370176.html,Israel amenaza a los activistas de la Flotilla de la Libertad con llevarlos a un centro de detención si no aceptan irse inmediatamente,0
https://www.eldiario.es/politica/pp-compara-cospedal-leire-audios-fiscal-grinda-consideracion_1_12368795.html,El PP compara a Cospedal y a Leire Díez por los audios en los que habla de “matar” al fiscal Grinda: “Tiene la misma consideración”,0
https://www.eldiario.es/politica/revelacion-montaje-cocaina-miguel-urban-impulsa-investigacion-guerra-sucia_1_12362546.html,La revelación del montaje con la cocaína a Miguel Urbán impulsa la investigación sobre la guerra sucia a Podemos,0
https://www.eldiario.es/sociedad/congregaciones-religiosas-piden-perdon-victimas-carceles-franquistas-adolescentes-reconocemos_1_12367824.html,Las víctimas de las 'cárceles' franquistas para mujeres jóvenes rechazan el perdón de las congregaciones religiosas,0
https://www.eldiario.es/sociedad/oferta-plazas-universidad-publica-lleva-anos-estancada-hay-grados-11-aspirantes-puesto_1_12360594.html,El freno a la universidad pública deja carreras con el 90% de aspirantes sin plaza,0
https://www.eldiario.es/politica/milei-promete-vistalegre-argentina-sera-primera-potencia-mundial_129_12367281.html,Milei promete en Vistalegre que Argentina será la primera potencia mundial,0
https://www.eldiario.es/madrid/investigacion-judicial-revela-receta-ayuso-residencias-pandemia-geriatra-quiron-asesor-contrato-conclave-secreto-sol_1_12362096.html,"La investigación judicial revela la receta de Ayuso para las residencias en pandemia: un geriatra de Quirón, un asesor sin contrato y un cónclave secreto",0
https://www.eldiario.es/madrid/ayuso-opcion-presentarse-liderar-pp-son-decisiones-futuro_1_12367938.html,"Ayuso, sobre la opción de presentarse a liderar el PP: “Son decisiones para el futuro”",0
