url,title,is_clickbait
https://elpais.com/internacional/2025-06-09/california-escala-el-conflicto-con-la-administracion-de-trump-con-una-demanda-por-la-presencia-de-la-guardia-nacional.html?autoplay=1,Trump aboga por detener al gobernador de California e incrementa la presencia militar en Los Ángeles con 500 marines,0
https://elpais.com/internacional/2025-06-09/trump-utiliza-las-protestas-en-los-angeles-para-hacer-una-demostracion-de-fuerza-frente-al-gobernador-newsom.html,Trump utiliza las protestas en Los Ángeles contra su política migratoria para hacer una demostración de fuerza frente al gobernador,0
https://elpais.com/us/migracion/2025-06-09/dentro-de-las-protestas-de-los-angeles-salimos-a-las-calles-porque-nuestros-padres-han-vivido-en-las-sombras-toda-su-vida.html,Dentro de las protestas de Los Ángeles: “Salimos a las calles porque nuestros padres han vivido en las sombras toda su vida”,0
https://elpais.com/mexico/2025-06-09/claudia-sheinbaum-replica-a-trump-los-mexicanos-que-viven-en-estados-unidos-son-trabajadores-honestos.html,Claudia Sheinbaum replica a Trump: “Los mexicanos que viven en Estados Unidos son trabajadores honestos”,0
https://elpais.com/us/migracion/2025-06-09/los-vecinos-de-newark-que-nunca-dejan-solos-a-los-migrantes-encerrados-en-delaney-hall.html,Los vecinos de Newark que nunca dejan solos a los migrantes encerrados en Delaney Hall,0
https://elpais.com/america-colombia/2025-06-09/las-horas-que-dejan-a-miguel-uribe-turbay-luchando-por-su-vida-un-mitin-improvisado-que-termino-con-dos-disparos-en-la-cabeza.html?autoplay=1,Un mitin improvisado que terminó con dos disparos en la cabeza: así fue el atentado contra Miguel Uribe,0
https://elpais.com/america-colombia/2025-06-09/atentado-contra-miguel-uribe-turbay-en-directo.html,"Las últimas noticias del atentado contra Miguel Uribe Turbay, en directo | La familia del senador presenta una denuncia contra la UNP por no haberle reforzado la seguridad",0
https://elpais.com/america-colombia/2025-06-09/la-fiscalia-aun-no-ha-podido-interrogar-al-sicario-que-atento-contra-miguel-uribe-turbay.html,La Fiscalía apunta a una red de sicarios como responsable del atentado contra el precandidato Miguel Uribe Turbay,0
https://elpais.com/ciencia/2025-06-09/ardem-patapoutian-nobel-de-medicina-el-90-de-las-personas-ni-siquiera-sabe-que-tiene-el-sentido-de-la-propiocepcion.html,"Ardem Patapoutian, nobel de Medicina: “El 90% de las personas ni siquiera sabe que tiene el sentido de la propiocepción”",0
https://elpais.com/us/migracion/2025-06-09/khaby-lame-el-famoso-de-tiktok-que-fue-detenido-por-ice.html,"Khaby Lame, el famoso de TikTok que fue detenido por ICE",0
https://elpais.com/internacional/2025-06-09/estados-unidos-y-china-buscan-recuperar-la-confianza-con-un-encuentro-sobre-aranceles-en-londres.html,Estados Unidos y China buscan recuperar la confianza con un encuentro sobre aranceles en Londres,0
https://elpais.com/internacional/2025-06-09/israel-intercepta-la-flotilla-de-la-libertad-que-se-dirigia-en-barco-a-gaza-con-ayuda.html?autoplay=1,La Flotilla de la Libertad con ayuda para Gaza en la que viajaba Greta Thunberg llega a Israel tras ser interceptada,0
https://elpais.com/internacional/2025-06-09/ultima-hora-del-conflicto-en-oriente-proximo-en-directo.html,"Última hora del conflicto en Oriente Próximo, en directo | La Flotilla de la Libertad llega al puerto israelí de Ashdod escoltada por el ejército",0
https://elpais.com/america/2025-06-09/margaret-satterthwaite-en-guatemala-hay-una-sensacion-de-que-se-esta-desmantelando-el-estado-de-derecho.html,Margaret Satterthwaite: “En Guatemala hay una sensación de que se está desmantelando el estado de derecho”,0
https://elpais.com/america/2025-06-09/el-poder-judicial-impide-la-salida-de-peru-del-expresidente-kuczynski-por-peligro-de-fuga.html,El Poder Judicial impide la salida de Perú del expresidente Kuczynski por peligro de fuga,0
https://elpais.com/america/2025-06-09/andy-warhol-y-el-arte-pop-hecho-en-brasil-dialogan-en-sao-paulo.html,Andy Warhol y el arte pop hecho en Brasil dialogan en São Paulo,0
https://elpais.com/argentina/2025-06-09/los-manuscritos-ineditos-de-borges-que-dejan-oir-su-voz-publican-los-cuadernos-donde-preparaba-sus-conferencias.html,Los manuscritos inéditos de Borges que dejan oír su voz: publican los cuadernos donde preparaba sus conferencias,0
https://elpais.com/cultura/2025-06-09/el-prado-homenajea-a-la-virgen-de-guadalupe-la-estrella-pop-que-unio-america-y-espana.html,"El Prado homenajea a la virgen de Guadalupe, la estrella pop que unió América y España",0
https://elpais.com/tecnologia/2025-06-09/wwdc-apple-presenta-el-primer-rediseno-de-sus-sistemas-operativos-desde-2013.html,WWDC 2025: Apple presenta el primer rediseño de sus sistemas operativos desde 2013,0
https://elpais.com/tecnologia/2025-06-09/muere-bill-atkinson-el-ingeniero-visionario-de-apple-que-hizo-accesibles-los-ordenadores-a-millones-de-usuarios-en-el-mundo.html,"Muere Bill Atkinson, el ingeniero visionario de Apple que hizo accesibles los ordenadores a millones de usuarios en el mundo",0
https://elpais.com/us/2025-06-06/reembolsos-de-impuestos-del-irs-fechas-de-pago-retrasos-y-como-darles-seguimiento.html,"Reembolsos de impuestos del IRS: fechas de pago, retrasos y cómo darles seguimiento",0
https://elpais.com/us/2025-06-04/detenciones-por-la-cbp-en-aeropuertos-lo-que-hay-que-saber-sobre-las-revisiones-de-redes-sociales.html,Detenciones por la CBP en aeropuertos: lo que hay que saber sobre las revisiones de redes sociales,0
https://elpais.com/us/migracion/2025-05-30/como-encontrar-a-un-inmigrante-detenido-por-ice.html,¿Cómo encontrar a un inmigrante detenido por ICE?,0
https://elpais.com/us/2025-05-24/estas-son-las-visas-que-trump-quiere-revocar-en-su-batalla-contra-harvard.html,Estas son las visas que Trump quiere revocar en su batalla contra Harvard,0
https://elpais.com/internacional/2025-06-09/moscu-asegura-que-sus-tropas-entran-por-primera-vez-en-la-provincia-de-dnipro-en-el-este-de-ucrania.html,"Moscú asegura que sus tropas entran por primera vez en la provincia de Dnipró, en el este de Ucrania",0
https://elpais.com/internacional/2025-06-09/dentro-de-un-taller-de-drones-camuflado-a-un-paso-del-frente-en-ucrania.html,"Dentro de un taller de drones camuflado, a un paso del frente en Ucrania",0
https://elpais.com/espana/2025-06-09/el-juez-del-supremo-situa-al-fiscal-general-al-borde-del-banquillo-por-un-delito-de-revelacion-de-secretos.html?autoplay=1,El juez del Supremo sitúa al fiscal general al borde del banquillo por un delito de revelación de secretos,0
https://elpais.com/internacional/2025-06-09/misa-de-espaldas-y-en-latin-el-vaticano-mira-de-reojo-el-exito-de-una-peregrinacion-tradicionalista-en-francia.html,Misa de espaldas y en latín: el Vaticano mira de reojo el éxito de una peregrinación tradicionalista en Francia,0
https://elpais.com/internacional/2025-06-09/la-oposicion-italiana-fracasa-en-su-intento-de-hacer-tambalearse-a-meloni-con-un-referendum.html,La oposición italiana fracasa en su intento de hacer tambalearse a Meloni con un referéndum,0
https://elpais.com/internacional/2025-06-09/sabado-de-instruccion-militar-para-civiles-en-polonia-quiero-aprender-cosas-utiles-en-caso-de-guerra-es-mi-deber-patriotico.html,Sábado de instrucción militar para civiles en Polonia: “Quiero aprender cosas útiles en caso de guerra; es mi deber patriótico”,0
https://elpais.com/america/2025-06-09/la-guerra-del-narco-revive-en-chiapas-y-los-enfrentamientos-atraviesan-la-frontera-con-guatemala.html,La guerra del narco revive en Chiapas y los enfrentamientos atraviesan la frontera con Guatemala,0
https://elpais.com/economia/2025-06-09/los-aranceles-abren-una-oportunidad-para-america-latina-y-europa-no-hay-que-perder-el-tiempo-llorando.html,Los aranceles abren una oportunidad para América Latina y Europa: “No hay que perder el tiempo llorando”,0
https://elpais.com/america-colombia/2025-06-09/el-gobierno-alista-el-boton-rojo-de-escape-fiscal-para-flexibilizar-el-techo-de-la-deuda.html,El Gobierno alista el ‘botón rojo’ de escape fiscal para flexibilizar el techo de la deuda,0
https://cincodias.elpais.com/economia/2025-06-09/historia-de-dos-potencias-la-fiable-europa-y-la-incierta-estados-unidos-separan-sus-caminos.html,Historia de dos potencias: la fiable Europa y la incierta Estados Unidos separan sus caminos,0
https://cincodias.elpais.com/companias/2025-06-09/louis-vuitton-demanda-a-un-pequeno-fabricante-de-licores-portugues-del-alto-mino.html,Louis Vuitton demanda a un pequeño fabricante de licores portugués del Alto Miño​ por el parecido de su logo,0
https://elpais.com/ciencia/2025-06-09/la-ultima-cena-de-un-dinosaurio-los-intestinos-de-un-sauropodo-que-vivio-hace-100-millones-de-anos-revelan-como-comian.html,La última cena de un dinosaurio: los intestinos de un saurópodo que vivió hace 100 millones de años revelan cómo comían,0
https://elpais.com/ciencia/2025-06-09/los-princesa-de-girona-reconocen-a-dos-jovenes-comprometidas-con-el-acceso-a-la-salud-en-latinoamerica.html,Los Princesa de Girona reconocen a dos jóvenes comprometidas con el acceso a la salud en Latinoamérica,0
https://elpais.com/clima-y-medio-ambiente/2025-06-09/construir-carriles-bici-como-en-copenhague-en-ciudades-de-todo-el-mundo-ahorraria-435000-millones-al-ano-en-salud.html,Construir carriles bici como en Copenhague en ciudades de todo el mundo ahorraría 435.000 millones al año en salud,0
https://elpais.com/clima-y-medio-ambiente/2025-06-09/espana-ampliara-sus-reservas-marinas-y-protegera-la-enorme-guarderia-de-cachalotes-al-norte-de-menorca.html,España ampliará sus reservas marinas y protegerá la enorme ‘guardería’ de cachalotes al norte de Menorca,0
https://elpais.com/america/2025-06-09/una-joven-acusada-de-abortar-en-honduras-reabre-el-debate-por-la-despenalizacion.html,Una joven acusada de abortar en Honduras reabre el debate por la despenalización,0
https://elpais.com/opinion/2025-06-09/el-espectaculo-mas-grande-de-las-redes.html,El espectáculo más grande de las redes,0
https://elpais.com/opinion/2025-06-09/el-debil-hombre-fuerte-de-estados-unidos.html,El débil ‘hombre fuerte’ de Estados Unidos,0
https://elpais.com/opinion/2025-06-09/occidente-debe-castigar-a-netanyahu-no-a-israel.html,"Occidente debe castigar a Netanyahu, no a Israel",0
https://elpais.com/america-futura/2025-06-09/de-la-inversion-de-polos-al-cinturon-de-van-allen-los-fisicos-que-sumaron-realismo-al-el-eternauta.html,De la inversión de polos al cinturón de ‘Van Allen’: los físicos que sumaron realismo al ‘El Eternauta’,0
https://elpais.com/america-futura/2025-06-08/dos-lecciones-desde-brasil-y-colombia-para-enriquecer-el-espacio-publico-en-las-ciudades.html,Dos lecciones desde Brasil y Colombia para enriquecer el espacio público en las ciudades,0
https://elpais.com/america-futura/2025-06-07/ellas-en-las-montanas-las-brasilenas-se-organizan-contra-el-miedo-y-el-machismo-en-los-caminos.html,Ellas en las montañas: las brasileñas se organizan contra el miedo y el machismo en los caminos,0
https://elpais.com/america-futura/2025-06-07/caf-invertira-2500-millones-de-dolares-para-preservar-los-oceanos-de-america-latina-y-el-caribe.html,CAF invertirá 2.500 millones de dólares para preservar los océanos de América Latina y el Caribe,0
https://elpais.com/america/2025-06-09/la-fiebre-las-munecas-hiperrealistas-atrapa-a-brasil-con-videos-virales-y-propuestas-de-ley.html?autoplay=1,La fiebre de las muñecas hiperrealistas atrapa a Brasil con videos virales y propuestas de ley,0
https://elpais.com/cultura/2025-06-09/berna-gonzalez-harbour-se-embarca-en-una-epopeya-familiar-que-refleja-un-mundo-roto.html,Berna González Harbour se embarca en una epopeya familiar que refleja un mundo roto,0
https://elpais.com/smoda/placeres/2025-06-09/mercedes-cebrian-escritora-ahora-ir-de-compras-se-ve-casi-como-algo-vergonzante.html,"Mercedes Cebrián, escritora: “Ahora ir de compras se ve casi como algo vergonzante”",0
https://elpais.com/cultura/2025-06-09/juan-diego-botto-en-el-laberinto-de-las-nuevas-familias-la-crianza-ya-no-es-lo-que-era-porque-nuestras-relaciones-ya-no-son-lo-que-eran.html,"Juan Diego Botto, en el laberinto de las nuevas familias: “La crianza ya no es lo que era porque nuestras relaciones ya no son lo que eran”",0
https://elpais.com/cultura/2025-06-09/muere-a-los-86-anos-el-escritor-britanico-frederik-forsyth-autor-de-chacal.html?autoplay=1,"Adiós a Frederick Forsyth, el rey del ‘thriller’ que cambió las reglas del relato de suspense con ‘Chacal’ y ‘Odessa’",0
https://elpais.com/cultura/2025-06-09/liz-pelly-la-periodista-que-descubrio-las-granjas-de-artistas-falsos-de-spotify-en-una-hora-producen-docenas-de-canciones.html,"Liz Pelly, la periodista que descubrió las granjas de ‘artistas falsos’ de Spotify: “En una hora, producen docenas de canciones”",0
https://elpais.com/cultura/2025-06-09/un-juez-desestima-la-demanda-por-difamacion-de-400-millones-de-dolares-de-justin-baldoni-contra-blake-lively.html,Un juez desestima la demanda por difamación de 400 millones de dólares de Justin Baldoni contra Blake Lively,0
https://elpais.com/gente/2025-06-09/asi-es-cole-escola-artista-no-binario-y-premio-tony-a-mejor-actor-en-el-papel-de-una-mujer.html,"Así es Cole Escola, artista no binario y premio Tony a mejor actor en el papel de una mujer",0
https://elpais.com/gente/2025-06-09/a-bruce-willis-le-dictaban-las-frases-de-sus-dialogos-por-un-pinganillo-para-ocultar-los-sintomas-de-sus-enfermedades-segun-revela-su-esposa.html,"A Bruce Willis le dictaban las frases de sus diálogos por un pinganillo para ocultar los síntomas de sus enfermedades, según revela su esposa",0
https://elpais.com/gente/2025-06-09/kris-jenner-convierte-su-cirugia-estetica-en-un-negocio-saca-a-la-venta-camisetas-y-gorras.html,Kris Jenner convierte su cirugía estética en un negocio: saca a la venta camisetas y gorras,0
https://elpais.com/icon/2025-06-09/entre-la-nostalgia-y-el-alivio-que-hace-un-hombre-de-40-anos-esperando-con-ilusion-un-nuevo-super-mario.html,Entre la nostalgia y el alivio: ¿qué hace un hombre de 40 años esperando con ilusión un nuevo Super Mario?,0
https://elpais.com/estilo/2025-06-09/ana-lamata-la-artesana-de-los-sombreros-que-se-exponen-hasta-en-el-prado.html,"Ana Lamata, la artesana de los sombreros que se exponen hasta en El Prado",0
https://elpais.com/tecnologia/2025-06-09/wwdc-2025-que-esperar-de-la-conferencia-anual-para-desarrolladores-de-apple.html,WWDC 2025: qué esperar de la conferencia anual para desarrolladores de Apple,0
https://elpais.com/mamas-papas/actualidad/2025-06-09/como-ayudar-a-un-adolescente-con-ansiedad.html,Cómo ayudar a un adolescente con ansiedad,0
https://elpais.com/gastronomia/el-comidista/2025-06-09/la-tortilla-al-microondas-con-mayonesa-de-jose-andres-herejia-o-genialidad.html,La tortilla al microondas con mayonesa de José Andrés: ¿herejía o genialidad?,0
https://elpais.com/eps/2025-06-09/marta-cortizas-sumiller-de-el-celler-de-can-roca-el-vino-es-geografia-historia-climas-suelos.html,"Marta Cortizas, sumiller de El Celler de Can Roca: “El vino es geografía, historia, climas, suelos”",0
https://elpais.com/eps/2025-06-08/un-verano-para-comerselo-entre-brasas-ostras-y-ensaimadas.html,"Un verano para comérselo entre brasas, ostras y ensaimadas",0
https://elpais.com/deportes/futbol/2025-06-09/el-rock-de-mastantuono-asi-es-el-futbolista-argentino-de-17-anos-que-iba-para-tenista-y-que-apunta-al-real-madrid.html,El ‘rock’ de Mastantuono: así es el futbolista argentino de 17 años que iba para tenista y que apunta al Real Madrid,0
https://elpais.com/deportes/futbol/2025-06-09/lewandowski-recibe-duras-criticas-tras-anunciar-su-retirada-de-la-seleccion-polaca-mientras-michal-probierz-sea-el-entrenador.html,Lewandowski recibe duras críticas tras anunciar su retirada de la selección polaca mientras Michal Probierz sea el entrenador,0
https://elpais.com/deportes/baloncesto/2025-06-09/oklahoma-city-thunder-iguala-la-final-de-la-nba-tras-secar-el-ataque-de-los-indiana-pacers.html,Oklahoma City Thunder iguala la final de la NBA tras secar el ataque de los Indiana Pacers,0
https://elpais.com/deportes/tenis/2025-06-09/la-transparencia-de-carlos-alcaraz.html,La transparencia de Carlos Alcaraz,0
https://elpais.com/deportes/2025-06-09/la-imagen-de-los-jugadores-de-la-seleccion-viendo-en-el-cesped-el-thriller-de-alcaraz-y-sinner-antes-de-su-final.html,La imagen de los jugadores de la selección viendo en el césped el “thriller” de Alcaraz y Sinner antes de su final,0
https://elpais.com/america-colombia/2025-06-08/el-atentado-contra-miguel-uribe-revive-la-pesadilla-de-los-magnicidios-en-colombia.html?autoplay=1,Colombia revive la pesadilla de los magnicidios con el atentado contra Miguel Uribe,0
https://elpais.com/mexico/2025-06-08/rehenes-de-la-extorsion-en-mexico.html,Rehenes de la extorsión en México,0
https://elpais.com/gente/2025-06-08/barbara-rey-el-rey-juan-carlos-estuvo-mas-enamorado-de-mi-que-yo-de-el.html,Bárbara Rey: “El rey Juan Carlos estuvo más enamorado de mí que yo de él”,0
https://elpais.com/argentina/2025-06-08/mirtha-legrand-la-diva-de-la-television-argentina-que-a-los-98-anos-no-piensa-en-la-jubilacion.html,"Mirtha Legrand, la diva de la televisión argentina que a los 98 años no piensa en la jubilación",0
https://english.elpais.com/usa/2025-06-09/inside-the-la-protests-we-took-to-the-streets-because-our-parents-have-lived-in-the-shadows-their-entire-lives.html?autoplay=1,Inside the L.A. protests: ‘We took to the streets because our parents have lived in the shadows their entire lives’,0
https://english.elpais.com/usa/2025-06-09/from-unconditional-love-to-total-war-trump-and-musks-bromance-and-breakup-in-four-acts.html,From unconditional love to ‘total war’: Trump and Musk’s bromance and breakup in four acts,0
https://english.elpais.com/international/2025-06-09/the-attempted-assassination-of-colombian-politician-miguel-uribe-turbay-threatens-a-return-to-the-violence-of-the-past.html,The attempted assassination of Colombian politician Miguel Uribe Turbay threatens a return to the violence of the past,0
https://english.elpais.com/science-tech/2025-06-09/ardem-patapoutian-nobel-prize-winner-in-medicine-90-of-people-dont-even-know-they-have-a-sense-of-proprioception.html,"Ardem Patapoutian, Nobel Prize winner in Medicine: ‘90% of people don’t even know they have a sense of proprioception’",0
https://english.elpais.com/culture/2025-06-09/andy-warhol-and-brazilian-pop-art-converse-in-sao-paulo.html,Andy Warhol and Brazilian Pop Art converse in São Paulo,0
https://elpais.com/us/2025-06-08/la-orquesta-internacional-del-orgullo-se-muda-a-maryland-por-el-veto-de-trump-para-tocar-en-el-kennedy-center.html?autoplay=1,La Orquesta Internacional del Orgullo se muda a Maryland por el veto de Trump para tocar en el Kennedy Center,0
https://elpais.com/us/2025-06-06/las-preocupaciones-ante-el-nuevo-veto-migratorio-de-trump.html?autoplay=1,Las preocupaciones ante el nuevo veto migratorio de Trump,0
https://elpais.com/america/2025-06-05/los-incendios-en-canada-se-extienden-sin-control.html?autoplay=1,Los incendios en Canadá se extienden sin control,0
https://los40.us/2025/which-latin-artist-performing-at-the-fifa-club-world-cup-final-halftime-show-34772.html,Which Latin Artist Is Performing at the FIFA Club World Cup Final Halftime Show?,0
https://los40.us/2025/chris-martin-sends-emotional-message-to-dakota-johnson-after-breakup-34736.html,Chris Martin Sends Emotional Message to Dakota Johnson After Breakup,0
https://elpais.com/us/migracion/2025-06-08/trump-movilizara-a-la-guardia-nacional-a-los-angeles-por-las-manifestaciones-contra-sus-redadas-migratorias.html?autoplay=1,Trump envía 2.000 soldados a Los Ángeles tras dos días de protestas por la ‘caza’ de indocumentados,0
https://elpais.com/america-colombia/2025-06-07/el-senador-colombiano-miguel-uribe-turbay-es-victima-de-un-atentado-en-un-evento-publico-en-bogota.html,El senador y precandidato presidencial colombiano Miguel Uribe Turbay sufre un atentado en un acto de campaña,0
https://cincodias.elpais.com/mercados-financieros/2025-06-08/la-banca-se-quita-complejos-en-bolsa-y-fia-al-crecimiento-la-continuidad-de-su-rally.html,La banca se quita complejos en Bolsa y fía al crecimiento la continuidad de su rally,0
https://cincodias.elpais.com/mercados-financieros/2025-06-08/merece-la-pena-invertir-en-deuda-soberana.html,¿Merece la pena invertir en deuda soberana?,0
https://elpais.com/mexico/2025-06-08/el-neorshoring-desafia-la-incertidumbre-por-los-aranceles-y-repunta-en-mexico.html,El ‘nearshoring’ desafía la incertidumbre por los aranceles y repunta en México,0
https://elpais.com/internacional/2025-06-08/del-amor-incondicional-a-la-guerra-total-romance-y-ruptura-de-trump-y-musk-en-cuatro-actos.html,Del amor incondicional a la guerra total: romance y ruptura de Trump y Musk en cuatro actos,0
https://elpais.com/america-colombia/2025-06-08/quien-es-miguel-uribe-turbay-el-senador-y-precandidato-presidencial-herido-en-un-atentado.html,"Miguel Uribe Turbay, el joven político hijo de una periodista asesinada y nieto de un expresidente que representa una derecha tradicional",0
https://elpais.com/cultura/2025-06-08/la-pintora-soledad-sevilla-ingresa-en-la-real-academia-de-bellas-artes.html,La pintora Soledad Sevilla ingresa en la Real Academia de Bellas Artes,0
https://elpais.com/cultura/2025-06-08/paul-mccartney-se-une-por-sorpresa-a-bruce-springsteen-en-un-concierto-en-liverpool.html,Paul McCartney se une por sorpresa a Bruce Springsteen en un concierto en Liverpool,0
https://elpais.com/cultura/2025-06-08/las-mil-caras-de-willem-dafoe-la-estrella-de-hollywood-se-sumerge-en-el-teatro-experimental-en-venecia.html,Las mil caras de Willem Dafoe: la estrella de Hollywood se sumerge en el teatro experimental en Venecia,0
https://elpais.com/salud-y-bienestar/2025-06-09/la-tortura-de-tener-vulvodinia-y-no-ser-escuchada-durante-mas-de-dos-anos-los-medicos-me-hicieron-sentir-que-estaba-loca.html,La tortura de tener vulvodinia y no ser escuchada: “Durante más de dos años los médicos me hicieron sentir que estaba loca”,0
https://elpais.com/salud-y-bienestar/2025-06-08/la-enigmatica-huella-de-los-microplasticos-en-la-salud-se-desconocen-los-efectos-a-largo-plazo.html,La enigmática huella de los microplásticos en la salud: “Se desconocen los efectos a largo plazo”,0
https://elpais.com/deportes/2025-06-09/el-f50-espanol-sale-lider-del-sailgp-tras-su-triunfo-en-el-gran-premio-de-nueva-york.html,El F50 español sale líder del SailGP tras su triunfo en el Gran Premio de Nueva York,0
https://elpais.com/deportes/futbol/2025-06-09/el-misterio-de-abuelotti.html,El misterio de ‘Abuelotti’,0
https://elpais.com/clima-y-medio-ambiente/2025-06-07/john-kerry-vivimos-una-nueva-etapa-de-terraplanismo-y-hay-gente-tratando-de-vender-que-el-cambio-climatico-es-un-engano.html,John Kerry: “Vivimos una nueva etapa de terraplanismo y hay gente tratando de vender que el cambio climático es un engaño”,0
https://elpais.com/clima-y-medio-ambiente/2025-06-06/ibiza-se-queda-sin-lagartijas-la-serpiente-invasora-que-se-las-come-ocupa-ya-el-90-de-la-isla-y-llega-a-nado-a-los-islotes.html,Ibiza se queda sin lagartijas: la serpiente invasora que se las come ocupa ya el 90% de la isla y llega a nado a los islotes,0
https://elpais.com/clima-y-medio-ambiente/2025-06-05/xan-lopez-activista-no-es-realista-esperar-a-la-abolicion-del-capitalismo-para-superar-la-crisis-climatica.html,"Xan López, activista: “No es realista esperar a la abolición del capitalismo para superar la crisis climática”",0
https://www.lavanguardia.com/politica/20250609/10768512/supremo-pone-paso-banquillo-fiscal-general.html,El Supremo pone a un paso del banquillo al fiscal general del Estado,0
https://www.lavanguardia.com/politica/20250609/10769075/gobierno-ratifica-apoyo-fiscal-general-trata-desviar-foco-pp.html,El Gobierno ratifica su apoyo al fiscal general del Estado y trata de desviar el foco hacia el PP,0
https://www.lavanguardia.com/politica/20250609/10768922/pp-suma-renuncia-fiscal-general-exigencia-dimision-pedro-sanchez.html,El PP suma a la renuncia del fiscal general la exigencia de dimisión de Pedro Sánchez,0
https://www.lavanguardia.com/internacional/20250609/10770680/trump-quiere-detener-gobernador-california.html,Trump quiere detener al gobernador de California,0
https://www.lavanguardia.com/internacional/20250609/10770588/trump-dice-arrestaria-gobernador-california-protestas-angeles.html,El fiscal general de California anuncia una demanda contra Trump por el despliegue de los militares,0
https://www.lavanguardia.com/cultura/20250609/10770553/muere-novelista-britanico-frederick-forsyth.html,"Muere el novelista británico Frederick Forsyth, el espía eterno",0
https://www.lavanguardia.com/internacional/20250609/10770790/barco-flotilla-libertad-llega-puerto-israeli-asdod.html,El barco de la Flotilla de la Libertad llega al puerto israelí de Asdod,0
https://www.lavanguardia.com/politica/20250609/10767865/semilla-deja-oscar.html,La semilla que deja Óscar,0
https://www.lavanguardia.com/politica/20250609/10770641/gobierno-flexibiliza-criterios-proxima-regularizacion-masiva-inmigrantes.html,El Gobierno flexibiliza los criterios para la proxima regularización masiva de inmigrantes,0
https://www.lavanguardia.com/politica/20250609/10768832/jueza-ve-fraude-ley-aforamiento-in-extremis-lider-psoe-extremadura.html,La jueza ve fraude de ley en el aforamiento 'in extremis' del líder del PSOE en Extremadura,0
https://www.lavanguardia.com/vida/20250609/10755231/doctor-amonestado-atender-nina-moribunda-fuera-horario-afectado.html,El doctor amonestado por atender a una niña moribunda fuera de su horario: “Estoy muy afectado”,0
